filepath,filename,parent_folder,lines,num_classes,num_functions,class_names,category,revenue_tier,docstring,key_imports,file_size_kb,last_modified
pythons/audio_video_conversion/downloaders/complete_flatten.py,complete_flatten.py,downloaders,188,0,5,,Audio_Processing,Tier_4_Utility,Complete Directory Flattening Script Moves ALL files from subdirectories to the root level with descriptive prefixes,"os, pathlib, shutil, re, collections",6,2025-12-01
pythons/remove_duplicates_downloads.py,remove_duplicates_downloads.py,pythons,187,0,2,,Utilities,Tier_4_Utility,Safely remove duplicate files from Downloads directory.,"csv, os, pathlib, datetime, shutil, sys",7,2025-12-25
pythons/audio_video_conversion/downloaders/flatten_directory.py,flatten_directory.py,downloaders,186,0,5,,Audio_Processing,Tier_4_Utility,Directory Flattening Script Moves all files from subdirectories to the root level with descriptive prefixes,"os, pathlib, shutil, re, collections",6,2025-12-01
pythons/download_large_gdrive_files.py,download_large_gdrive_files.py,pythons,185,0,4,,Utilities,Tier_4_Utility,Download all files >200MB from Google Drive using rclone.,"argparse, subprocess, pathlib, json, typing, sys",4,2025-12-26
pythons/export_paste_history.py,export_paste_history.py,pythons,185,0,2,,Utilities,Tier_4_Utility,Export Paste.app clipboard history to readable markdown format,"sqlite3, pathlib, datetime, shutil, json",5,2025-12-04
pythons/2T-Xx-python/MEDIA_PROCESSING/image_upscaling/upscaled.py,upscaled.py,image_upscaling,185,0,7,,Image_Processing,Tier_4_Utility,,"time, csv, os, datetime, PIL, json, requests, dotenv",6,2025-12-25
pythons/safe_duplicate_cleanup.py,safe_duplicate_cleanup.py,pythons,184,1,8,SafeDuplicateCleanup,File_Organization,Tier_3_Standard,Safe Duplicate Cleanup Script Removes numbered duplicates while preserving original files,"re, pathlib, datetime, json",7,2025-12-01
pythons/audio_video_conversion/api_clients/leonardo_motion_cli.py,leonardo_motion_cli.py,api_clients,184,0,4,,Audio_Processing,Tier_4_Utility,leonardo_motion_cli.py A safe Leonardo.AI CLI to: generate image -> upscale -> motion video (SVD).  Improvements vs original: - No hardcoded API key. Uses LEONARDO_API_KEY from env or --api-key. - CLI,"time, argparse, os, __future__, pathlib, json, requests, typing, sys",8,2025-12-01
pythons/AUTOMATION_BOTS/social_media_automation/social_media_part2/subreddit.py,subreddit.py,social_media_part2,184,0,1,,Reddit_Automation,Tier_4_Utility,,"praw, utils.subreddit, utils.posttextparser, utils.voice, prawcore.exceptions, utils.ai_methods, re, utils.console, utils.videos, logging",7,2025-12-01
pythons/find_duplicates.py,find_duplicates.py,pythons,182,0,2,,Utilities,Tier_4_Utility,Find duplicate files in Google Drive directories. Identifies duplicates by name; size; and content hash.,"csv, os, pathlib, hashlib, collections",6,2025-12-24
pythons/AUTOMATION_BOTS/social_media_automation/Instagram-Bot/bot_follow.py,bot_follow.py,Instagram-Bot,181,0,6,,Instagram_Automation,Tier_4_Utility,,"time, tqdm",6,2025-12-01
pythons/organize_by_category.py,organize_by_category.py,pythons,180,0,5,,File_Organization,Tier_4_Utility,Smart File Organization Script Organizes Python files based on functional category analysis results.,"argparse, pathlib, shutil, json, traceback, typing",5,2025-12-01
pythons/file_organization/CLEANUP_LOVE_IN_IMPERFECTION.py,CLEANUP_LOVE_IN_IMPERFECTION.py,file_organization,177,0,1,,File_Organization,Tier_4_Utility,from datetime import datetime from pathlib import Path import json import shutil Clean up Love_In_Imperfection folder - consolidate duplicates and organize versions Based on analysis of 6 MP3 files wi,,6,2025-12-01
pythons/remove_duplicates.py,remove_duplicates.py,pythons,176,0,2,,Utilities,Tier_4_Utility,Safely remove duplicate files from Google Drive. Includes dry-run mode and backup options.,"csv, os, pathlib, datetime, shutil, sys",6,2025-12-24
pythons/audio_video_conversion/audio_tools/audio_chunker.py,audio_chunker.py,audio_tools,176,1,8,AudioChunker,Audio_Processing,Tier_3_Standard,Audio chunking utilities for handling long files,"os, moviepy.editor, pathlib, config, logging, typing",7,2025-12-01
workspace/advanced_toolkit/create_new_series_volumes.py,create_new_series_volumes.py,advanced_toolkit,176,0,2,,Utilities,Tier_4_Utility,Create New Series Volumes Based on user's preference: Create themed series; NOT generic Vol_13/14,"pathlib, difflib, csv, shutil",5,2025-11-04
pythons/sort_2.py,sort_2.py,pythons,175,0,6,,Utilities,Tier_4_Utility,,"ffmpeg, csv, os, datetime, PIL",6,2025-12-01
pythons/organize_files_from_utilities.py,organize_files_from_utilities.py,pythons,175,0,3,,File_Organization,Tier_4_Utility,File Organization Script for AI Export Tools Implements the recommendations from the analysis report,"pathlib, datetime, shutil",7,2025-12-01
pythons/FINAL_POLISH_CLEANUP.py,FINAL_POLISH_CLEANUP.py,pythons,173,1,5,FinalPolish,File_Organization,Tier_4_Utility,✨ FINAL POLISH CLEANUP Fix the last 5 consolidation opportunities: 27 → 23 directories,"pathlib, datetime, shutil",6,2025-12-04
pythons/CONTENT_AWARE_CATALOG/create_content_aware_organization.py,create_content_aware_organization.py,CONTENT_AWARE_CATALOG,170,0,2,,Utilities,Tier_4_Utility,Content-Aware Organization System Creates subdirectories based on content categories and symbolic links to original files,"csv, os, pathlib, datetime, shutil, json",6,2025-12-04
workspace/advanced_toolkit/compare_with_suno_catalog.py,compare_with_suno_catalog.py,advanced_toolkit,170,0,3,,Utilities,Tier_4_Utility,Compare YOUR_SUNO_SONGS files with Suno catalog CSVs Find which songs you have vs what's in your Suno account,"pathlib, csv, collections",5,2025-11-04
pythons/cleanup_duplicates.py,cleanup_duplicates.py,pythons,169,0,5,,File_Organization,Tier_4_Utility,Duplicate Cleanup Script Provides options to safely remove duplicate files,"json, os, shutil",6,2025-12-01
pythons/convert_cursor_chats.py,convert_cursor_chats.py,pythons,169,0,4,,Utilities,Tier_4_Utility,Convert Cursor AI chat databases to Markdown format,"sqlite3, pathlib, datetime, json, html",5,2025-12-04
pythons/organize_project2025_subdirs.py,organize_project2025_subdirs.py,pythons,168,0,4,,File_Organization,Tier_4_Utility,,"argparse, shutil, os",5,2025-12-01
pythons/audio_video_conversion/downloaders/server.py,server.py,downloaders,168,1,11,HTTPHandler,Audio_Processing,Tier_3_Standard,,"time, settings, vidGen, os, ftplib, http.server, pyftpdlib.servers, json, pyftpdlib.handlers, traceback",5,2025-12-01
pythons/2T-Xx-python/MEDIA_PROCESSING/image_upscaling/upscalerr.py,upscalerr.py,image_upscaling,167,0,8,,Image_Processing,Tier_4_Utility,,"time, tqdm, csv, os, datetime, PIL",5,2025-12-01
pythons/audio_video_conversion/config_tools/final_duplicate_merge.py,final_duplicate_merge.py,config_tools,166,1,3,FinalMerge,Audio_Processing,Tier_4_Utility,Final Duplicate Merge - Eliminate remaining redundancies Merge underscore/hyphen variants and similar categories,"pathlib, shutil, sys",5,2025-12-01
pythons/file_organization/execute_cleanup.py,execute_cleanup.py,file_organization,166,0,4,,File_Organization,Tier_4_Utility,from pathlib import Path import csv import shutil Execute the cleanup plan from FILENAME_CLEANUP_MAPPING.csv 1. Delete duplicates from mp3s folder 2. Rename files in album folders,,4,2025-12-01
pythons/AUTOMATION_BOTS/social_media_automation/social_media_part2/leonardo-instagram-build.py,leonardo-instagram-build.py,social_media_part2,166,0,6,,Instagram_Automation,Tier_4_Utility,,"pathlib, csv, sys",5,2025-12-01
pythons/code_analysis/review_true_duplicates.py,review_true_duplicates.py,code_analysis,165,0,3,,Utilities,Tier_4_Utility,from pathlib import Path import csv import hashlib  from mutagen.easyid3 import EasyID3 from mutagen.mp3 import MP3 Review True Duplicates Identify and prepare cleanup for the 8 true duplicate groups,,5,2025-12-01
pythons/AUTOMATION_BOTS/social_media_automation/Instagram-Bot/TikTok-Compilation-Video-Generator/TikTok Server/filtercreator.py,filtercreator.py,TikTok Server,165,2,5,"Filter, FilterCreationWindow",Instagram_Automation,Tier_3_Standard,,"PyQt5, os, PyQt5.QtMultimedia, database, PyQt5.QtCore, PyQt5.QtWidgets, scriptwrapper",5,2025-12-01
pythons/execute_enhanced_reorganization.py,execute_enhanced_reorganization.py,pythons,162,1,3,EnhancedReorganizationExecutor,Utilities,Tier_4_Utility,Execute Enhanced Reorganization Move files to enhanced; more specific categories,"pathlib, json, sys, shutil",5,2025-12-01
pythons/file_organization/ORGANIZE_COMPLETE_SONGS.py,ORGANIZE_COMPLETE_SONGS.py,file_organization,162,0,1,,File_Organization,Tier_4_Utility,from pathlib import Path import re import shutil  from difflib import SequenceMatcher Organize the 100 complete songs into album folders: SongName/ ??? files/       (audio) ??? prompts/     (transcrip,,4,2025-12-01
pythons/file_organization/CLEAN_FILENAMES.py,CLEAN_FILENAMES.py,file_organization,162,0,1,,Utilities,Tier_4_Utility,"from pathlib import Path import re import shutil  from mutagen.easyid3 import EasyID3 from mutagen.mp3 import MP3 Clean all filenames: Title_artist.mp3 No ""01 - Artist - Title"" format No spaces; use u",,4,2025-12-01
pythons/execute_improved_reorganization.py,execute_improved_reorganization.py,pythons,161,1,5,ImprovedReorganizer,Utilities,Tier_4_Utility,Execute Improved Reorganization  Safely reorganizes files based on improved analysis,"argparse, pathlib, datetime, shutil, json, sys",5,2025-12-01
workspace/advanced_toolkit/integrate_user_updates.py,integrate_user_updates.py,advanced_toolkit,161,0,2,,Utilities,Tier_4_Utility,Integrate User Updates Merge user's edits from Downloads CSV back into unified catalog,"pathlib, csv, shutil",5,2025-11-04
pythons/audio_video_conversion/generators/lazy.py,lazy.py,generators,159,0,3,,Audio_Processing,Tier_4_Utility,,,6,2025-12-01
workspace/advanced_toolkit/apply_your_exact_structure.py,apply_your_exact_structure.py,advanced_toolkit,157,0,1,,Utilities,Tier_4_Utility,Apply Your Exact Structure Match the And_Also_Special_Guest format: - files/; images/; metadata/; prompts/ - Filenames: Artist - Song Title.mp3 (NO track numbers) - README.md for info,"pathlib, csv, shutil",5,2025-11-04
pythons/execute_deep_reorganization.py,execute_deep_reorganization.py,pythons,156,1,3,DeepReorganizationExecutor,Utilities,Tier_4_Utility,Execute Deep Reorganization Move files to ultra-specific categories based on analysis,"pathlib, json, sys, shutil",5,2025-12-01
pythons/cleanup2_from_03_utilities.py,cleanup2_from_03_utilities.py,pythons,156,0,5,,File_Organization,Tier_4_Utility,,"csv, os, datetime, re, pandas",4,2025-10-19
workspace/advanced_toolkit/add_downloads_to_bundles.py,add_downloads_to_bundles.py,advanced_toolkit,156,0,2,,Utilities,Tier_4_Utility,Add Downloads Content to Song Bundles Copy matched content from Downloads into existing song bundles,"pathlib, csv, shutil",4,2025-11-04
pythons/audio_video_conversion/uploaders/displaypub.py,displaypub.py,uploaders,155,2,6,"DisplayPublisher, CapturingDisplayPublisher",Audio_Processing,Tier_3_Standard,An interface for publishing rich data to frontends.  There are two components of the display system:  * Display formatters; which take a Python object and compute the   representation of the object in,"traitlets.config.configurable, traitlets, sys",4,2025-12-01
pythons/audio_video_conversion/video_editing/ClipCompilationCreator.py,ClipCompilationCreator.py,video_editing,155,1,7,ClipCompilationCreator,Audio_Processing,Tier_3_Standard,,"os, src, moviepy.editor, src.MetadataHandler, config, logging, moviepy.tools",5,2025-12-01
pythons/file_organization/cleanup2.py,cleanup2.py,file_organization,155,0,5,,File_Organization,Tier_4_Utility,,"csv, os, datetime, re, pandas",4,2025-12-01
pythons/FIX_NAMING_ISSUES.py,FIX_NAMING_ISSUES.py,pythons,154,1,5,NameFixer,Utilities,Tier_4_Utility,🔧 FIX NAMING ISSUES Fix spaces; special chars; and confusing names,"re, pathlib, datetime, shutil",5,2025-12-04
pythons/find_duplicates_downloads.py,find_duplicates_downloads.py,pythons,154,0,2,,Utilities,Tier_4_Utility,Find and remove duplicate files in Downloads directory.,"csv, os, pathlib, hashlib, collections",5,2025-12-25
pythons/audio_video_conversion/csv_tools/analyze_yt.py,analyze_yt.py,csv_tools,154,0,3,,AI_Analysis,Tier_2_Medium,,"pathlib, pandas, caas_jupyter_tools, ast, html, typing",4,2025-12-01
pythons/final_use_case_structure.py,final_use_case_structure.py,pythons,153,0,2,,Utilities,Tier_4_Utility,Final USE-CASE Optimized Structure Organize by what you want to DO; not what files ARE,"pathlib, shutil",5,2025-12-01
pythons/advanced-cleanup-analyzer.py,advanced-cleanup-analyzer.py,pythons,153,0,4,,File_Organization,Tier_4_Utility,Advanced cleanup analyzer - finds potentially removable packages,"subprocess, pathlib, sys",4,2025-12-04
pythons/AUTOMATION_BOTS/social_media_automation/social_media_part2/openai-csv-metadata-filler.py,openai-csv-metadata-filler.py,social_media_part2,153,0,3,,Data_Processing,Tier_4_Utility,,"tqdm, csv, os, openai, pathlib, logging, json, dotenv",4,2025-12-01
pythons/audio_video_conversion/test_setup.py,test_setup.py,audio_video_conversion,152,0,5,,Audio_Processing,Tier_4_Utility,Test script to verify the transcription analyzer setup,"moviepy, os, subprocess, openai, pathlib, whisper, sys, dotenv",4,2025-12-01
pythons/code_analysis/ffmpeg-installer.py,ffmpeg-installer.py,code_analysis,152,0,4,,Utilities,Tier_4_Utility,,"os, subprocess, zipfile, logging, requests",5,2025-12-01
pythons/AUTOMATION_BOTS/social_media_automation/social_media_part1/fancyname.py,fancyname.py,social_media_part1,151,0,4,,AI_Integration,Tier_4_Utility,,"csv, os, openai, pathlib, datetime, logging, dotenv",4,2025-12-01
workspace/advanced_toolkit/fix_downloaded_filenames.py,fix_downloaded_filenames.py,advanced_toolkit,150,0,2,,Utilities,Tier_4_Utility,"Fix Downloaded Filenames Remove ""-_"" prefix and clean up obvious naming issues NO transcription needed - we can tell what they are already","re, pathlib",3,2025-11-04
workspace/advanced_toolkit/separate_yours_vs_others.py,separate_yours_vs_others.py,advanced_toolkit,150,0,1,,Utilities,Tier_4_Utility,"Separate YOUR Music vs Others' Music - YOUR music: Goes in themed series volumes (Bite; Feather; Blues; etc.) - OTHERS' music: Goes in And_Also_Special_Guest/ with ""Artist - Song.mp3"" format","pathlib, csv, shutil",4,2025-11-04
pythons/AUTOMATION_BOTS/social_media_automation/Instagram-Bot/ultimate.py,ultimate.py,Instagram-Bot,149,0,12,,Instagram_Automation,Tier_3_Standard,,"time, argparse, os, config, glob, instabot, threading, sys, schedule",4,2025-12-01
pythons/AUTOMATION_BOTS/social_media_automation/social_media_part1/dalle-prompt.py,dalle-prompt.py,social_media_part1,148,0,4,,AI_Integration,Tier_4_Utility,,"csv, os, openai, pathlib, PIL, logging, requests, io, dotenv",4,2025-12-01
pythons/execute_context_fluid_reorganization.py,execute_context_fluid_reorganization.py,pythons,146,1,5,ContextFluidReorganizer,Utilities,Tier_4_Utility,Execute Context-Fluid Reorganization  Safely reorganizes files based on context-fluid analysis,"argparse, pathlib, datetime, shutil, json, sys",4,2025-12-01
pythons/audio_video_conversion/audio_tools/combine_audiobook.py,combine_audiobook.py,audio_tools,146,0,2,,Audio_Processing,Tier_4_Utility,Audiobook Combiner Combines individual segments into complete chapters and full audiobook,"pathlib, json, pydub",4,2025-12-01
pythons/AUTOMATION_BOTS/youtube_bots/youtube_part2/youtube-upload_api.py,youtube-upload_api.py,youtube_part2,146,0,3,,YouTube_Automation,Tier_2_Medium,,"time, constants, random, logging, googleapiclient.errors, googleapiclient.http, presets, googleapiclient.discovery, sys",4,2025-12-04
pythons/hash_subtitle_from_file-organizer.py,hash_subtitle_from_file-organizer.py,pythons,143,0,12,,File_Organization,Tier_3_Standard,,"time, argparse, os, config, glob, instabot, threading, sys, schedule",4,2025-12-01
pythons/AUTOMATION_BOTS/bot_tools/hash_text_2.py,hash_text_2.py,bot_tools,143,0,8,,Utilities,Tier_4_Utility,Bot functions to generate and post a comments.  Instructions to file with comments:     one line - one comment.  Example:     lol     kek,"datetime, tqdm",4,2025-12-01
workspace/advanced_toolkit/process_final_csv.py,process_final_csv.py,advanced_toolkit,143,0,3,,Data_Processing,Tier_4_Utility,Process Final CSV - Focus only on remaining files Based on YOUR_SUNO_SONGS_COMPLETE - MASTER_MERGED_DATA (1).csv,"argparse, csv, pathlib, shutil, collections",4,2025-11-04
pythons/extract_vid_from_file-organizer.py,extract_vid_from_file-organizer.py,pythons,142,0,4,,File_Organization,Tier_4_Utility,,"subprocess, requests, zipfile, os",5,2025-12-01
pythons/audio_video_conversion/audio_tools/generate_mp3s.py,generate_mp3s.py,audio_tools,142,0,4,,Audio_Processing,Tier_4_Utility,AlchemyAPI MP3 Generator Automatically generates MP3 files from quiz data using OpenAI's TTS API,"csv, os, pydub, requests, sys, dotenv",4,2025-12-01
pythons/2T-Xx-python/MEDIA_PROCESSING/image_upscaling/core/config.py,config.py,core,142,1,5,UpscaleConfig,Image_Processing,Tier_4_Utility,Centralized configuration management for image upscaling operations.  This module provides a unified configuration system to ensure consistent behavior across all upscaling scripts.,"dataclasses, pathlib, json, warnings, typing",4,2025-12-04
pythons/AUTOMATION_BOTS/youtube_bots/youtube_part1/youtube-generate.py,youtube-generate.py,youtube_part1,142,0,1,,YouTube_Automation,Tier_2_Medium,,"time, bs4, os, pathlib, imutils, selenium, chromedriver_autoinstaller, wand.image, cv2, logging",4,2025-12-04
pythons/AUTOMATION_BOTS/social_media_automation/social_media_part2/riddle.py,riddle.py,social_media_part2,142,0,4,,AI_Integration,Tier_4_Utility,,"csv, os, openai, pathlib, logging, dotenv",4,2025-12-01
pythons/file_organization/gpt-script-categorizer.py,gpt-script-categorizer.py,file_organization,141,0,6,,AI_Integration,Tier_4_Utility,,"os, openai, pathlib, shutil, re, logging, dotenv, hashlib",4,2025-12-01
pythons/AUTOMATION_BOTS/social_media_automation/social_media_part2/leonardo-cyberpunk-hacker-generator.py,leonardo-cyberpunk-hacker-generator.py,social_media_part2,141,0,1,,Utilities,Tier_4_Utility,,"time, os, pathlib, logging, requests, dotenv",4,2025-12-01
pythons/resize-skip-8below.py,resize-skip-8below.py,pythons,140,0,5,,Utilities,Tier_4_Utility,,"time, PIL, os",4,2025-12-04
pythons/FIX_MISPLACED_FILES.py,FIX_MISPLACED_FILES.py,pythons,140,1,4,MisplacedFixer,Utilities,Tier_4_Utility,📦 FIX MISPLACED FILES Move audio/video/image files to correct categories,"pathlib, shutil",4,2025-12-04
pythons/resize-skip-8below2.py,resize-skip-8below2.py,pythons,140,0,6,,Utilities,Tier_4_Utility,,"time, tqdm, PIL, os",4,2025-12-04
pythons/test_setup_from_file-organizer.py,test_setup_from_file-organizer.py,pythons,140,0,5,,File_Organization,Tier_4_Utility,Test script to verify the transcription analyzer setup,"moviepy, os, subprocess, openai, whisper, dotenv",4,2025-12-01
pythons/AUTOMATION_BOTS/social_media_automation/social_media_part2/pydescribe.py,pydescribe.py,social_media_part2,140,0,5,,AI_Integration,Tier_4_Utility,,"os, openai, pathlib, re, logging, dotenv",4,2025-12-01
pythons/AUTOMATION_BOTS/bot_tools/groupby_2_1.py,groupby_2_1.py,bot_tools,139,0,3,,Data_Processing,Tier_4_Utility,,"collections.abc, pandas._typing, __future__, pandas.plotting._matplotlib.misc, numpy, pandas.core.dtypes.missing, pandas, typing",4,2025-12-01
workspace/advanced_toolkit/cleanup_backup_folders.py,cleanup_backup_folders.py,advanced_toolkit,139,0,1,,File_Organization,Tier_4_Utility,Cleanup Backup Folders Consolidate or remove automatic backup folders safely,"pathlib, datetime, shutil",4,2025-11-04
pythons/AUTOMATION_BOTS/bot_tools/main_6_1.py,main_6_1.py,bot_tools,138,0,1,,Utilities,Tier_4_Utility,,"time, csv, os, codecs, selenium, selenium.webdriver.common.by, selenium.webdriver.chrome.options",4,2025-12-01
workspace/advanced_toolkit/cleanup_bundle_duplicates.py,cleanup_bundle_duplicates.py,advanced_toolkit,138,0,1,,File_Organization,Tier_4_Utility,Clean Up Bundle Duplicates Remove full copied files now that we have extracted content Keep only: AUDIO; EXTRACTED_CONTENT.txt; _bundle_info.json; README.txt,pathlib,4,2025-11-04
pythons/process_leonardo_from_file-organizer.py,process_leonardo_from_file-organizer.py,pythons,137,0,3,,File_Organization,Tier_4_Utility,,"tqdm, os, gzip, json, requests",4,2025-12-01
pythons/audio_video_conversion/cleaners/vidgenUI.py,vidgenUI.py,cleaners,136,1,8,renderingScreen,Audio_Processing,Tier_3_Standard,,"settings, PyQt5, vidGen, distutils.dir_util, shutil, server, PyQt5.QtGui, PyQt5.QtCore, traceback, PyQt5.QtWidgets",4,2025-12-01
pythons/bot-photo.py,bot-photo.py,pythons,135,0,4,,Utilities,Tier_4_Utility,,"os, tqdm, builtins",3,2025-12-01
pythons/download_json_from_file-organizer.py,download_json_from_file-organizer.py,pythons,135,0,3,,File_Organization,Tier_4_Utility,,"tqdm, os, gzip, json, requests",4,2025-12-01
pythons/audio_video_conversion/uncategorized/main_5_1.py,main_5_1.py,uncategorized,134,0,3,,Audio_Processing,Tier_4_Utility,,"math, reddit.subreddit, video_creation.screenshot_downloader, utils.ffmpeg_install, os, subprocess, pathlib, utils.cleanup, video_creation.background, utils.version",6,2025-12-01
pythons/audio_video_conversion/api_clients/googleapi-upload.py,googleapi-upload.py,api_clients,134,0,3,,Audio_Processing,Tier_4_Utility,,"google.oauth2.credentials, os, google_auth_oauthlib.flow, googleapiclient.errors, googleapiclient.http, googleapiclient.discovery",4,2025-10-19
pythons/AUTOMATION_BOTS/social_media_automation/social_media_part1/instagram-openai-download.py,instagram-openai-download.py,social_media_part1,132,0,4,,Instagram_Automation,Tier_4_Utility,,"csv, os, pathlib, logging, requests, dotenv",4,2025-12-01
pythons/audio_video_conversion/downloaders/flatten_all.py,flatten_all.py,downloaders,131,0,3,,Audio_Processing,Tier_4_Utility,Ultra-clean folder flattening script Moves all files to top-level organized folders,"pathlib, shutil",4,2025-12-01
workspace/advanced_toolkit/apply_easy_organization.py,apply_easy_organization.py,advanced_toolkit,131,0,1,,Utilities,Tier_4_Utility,Apply Easy Organization Actually create folders and move/rename files based on the plan,"pathlib, csv, shutil",3,2025-11-04
pythons/audio_video_conversion/api_clients/utils_03.py,utils_03.py,api_clients,130,0,11,,Audio_Processing,Tier_3_Standard,,"api, datetime, random, config, exceptions, requests, string",3,2025-10-19
pythons/check_vid_from_file-organizer.py,check_vid_from_file-organizer.py,pythons,128,0,4,,File_Organization,Tier_4_Utility,,"re, pandas, csv, os",3,2025-08-06
pythons/organize_media.py,organize_media.py,pythons,128,0,3,,File_Organization,Tier_4_Utility,Organize media and related text files by album base name.  - Scans a single-level directory (no recursion) for files. - Derives an album_name from the filename by removing the extension and   strippin,"pathlib, shutil, sys",4,2025-12-01
pythons/AUTOMATION_BOTS/youtube_bots/youtube_part1/youtube-downloadupload.py,youtube-downloadupload.py,youtube_part1,128,1,6,Downloadupload,YouTube_Automation,Tier_2_Medium,Ytdl,"ytdl.oshelper, ytdl.notify, ytdl.gmupload, ytdl.awsqueue, ytdl.models, __future__, ytdl.customerrors, logging, json, ytdl.audiodownload",4,2025-12-04
pythons/AUTOMATION_BOTS/social_media_automation/Instagram-Bot/YouTube-Bot/yt.py,yt.py,YouTube-Bot,128,0,6,,YouTube_Automation,Tier_2_Medium,,"bs4, google.oauth2.credentials, os, google_auth_oauthlib.flow, random, requests, googleapiclient.errors, googleapiclient.discovery",3,2025-12-01
pythons/AUTOMATION_BOTS/social_media_automation/social_media_part2/remove-background.py,remove-background.py,social_media_part2,127,0,4,,Utilities,Tier_4_Utility,,"time, os, pathlib, logging, requests, dotenv",4,2025-12-01
pythons/Targeted_Cleanup.py,Targeted_Cleanup.py,pythons,125,0,2,,File_Organization,Tier_4_Utility,Targeted cleanup: Fix obvious issues 1. Eliminate generic folder names (csv; json; pdf) 2. Remove timestamped duplicates 3. Flatten unnecessary nesting,"pathlib, datetime, shutil",4,2025-12-01
pythons/audio_video_conversion/downloaders/oshelper.py,oshelper.py,downloaders,124,0,17,,Audio_Processing,Tier_2_Medium,OS helper,"errno, logging, shutil, os",3,2025-08-06
pythons/AUTOMATION_BOTS/social_media_automation/social_media_part2/printify-blueprint-downloader.py,printify-blueprint-downloader.py,social_media_part2,123,0,3,,Utilities,Tier_4_Utility,,"os, pathlib, logging, json, requests, dotenv",3,2025-12-01
pythons/cleanup_from_03_utilities.py,cleanup_from_03_utilities.py,pythons,122,0,4,,File_Organization,Tier_4_Utility,,"re, pandas, csv, os",3,2025-10-19
pythons/AUTOMATION_BOTS/youtube_bots/youtube_part2/youtube-upload-file.py,youtube-upload-file.py,youtube_part2,122,0,5,,YouTube_Automation,Tier_2_Medium,,"time, tqdm, csv, os, openai, pathlib, logging, dotenv",6,2025-12-04
pythons/audio_video_conversion/audio_editing/duplicate_quiz-time.py,duplicate_quiz-time.py,audio_editing,119,0,3,,Audio_Processing,Tier_4_Utility,,"requests, csv, os, pydub",4,2025-12-01
pythons/file_organization/UNDO_CLEANUP.py,UNDO_CLEANUP.py,file_organization,119,0,1,,File_Organization,Tier_4_Utility,from pathlib import Path import shutil Undo the cleanup - return folders to original locations,,3,2025-12-01
pythons/test_instagram_from_file-organizer.py,test_instagram_from_file-organizer.py,pythons,117,1,7,TestConcatSort,Instagram_Automation,Tier_3_Standard,,"pytest, pandas, pandas._testing, numpy",4,2025-12-01
