filepath,filename,parent_folder,lines,num_classes,num_functions,class_names,category,revenue_tier,docstring,key_imports,file_size_kb,last_modified
pythons/analyze.py,analyze.py,pythons,258,0,7,,AI_Integration,Tier_4_Utility,,"time, concurrent.futures, tqdm, os, openai, termcolor, logging, dotenv, sys",9,2025-12-04
pythons/file_organization/instagram-bulk-renamer.py,instagram-bulk-renamer.py,file_organization,258,0,8,,Instagram_Automation,Tier_4_Utility,from pathlib import Path import argparse import ast import csv import hashlib import re Intelligent Bulk File Renamer Analyzes Python files and suggests content-aware names based on: - Docstrings - Co,,8,2025-12-01
pythons/auto_organize_dry_run_from_seo-optimizer.py,auto_organize_dry_run_from_seo-optimizer.py,pythons,256,1,5,AutoOrganizeDryRun,SEO_Optimization,Tier_2_Medium,AI Outputs Hub - Auto-Organize Dry Run Shows what auto-organize would do without making changes,"pathlib, datetime, collections",10,2025-12-01
pythons/SMART_DEDUPLICATE.py,SMART_DEDUPLICATE.py,pythons,255,1,7,SmartDeduplicator,AI_Analysis,Tier_2_Medium,🗑️ SMART DEDUPLICATION Remove duplicate files keeping only the best version,"csv, pathlib, datetime, shutil, ast, sys",8,2025-12-04
pythons/final_cleanup_summary_1.py,final_cleanup_summary_1.py,pythons,254,0,2,,File_Organization,Tier_4_Utility,Final Cleanup and Summary Script Provides a comprehensive summary of the Python backup analysis and merge process,"datetime, json",8,2025-12-01
workspace/advanced_toolkit/ultimate_music_intelligence.py,ultimate_music_intelligence.py,advanced_toolkit,254,2,7,"UltimateMusicIntelligence, ConfigManager",AI_Analysis,Tier_2_Medium,ULTIMATE MUSIC INTELLIGENCE SYSTEM Uses ALL fancy tools + ALL API keys + ALL workflows Complete end-to-end music management,"csv, os, subprocess, pathlib, datetime, json, config_manager, sys",8,2025-11-04
pythons/SUB_CATEGORIZE_BIG_FOLDERS.py,SUB_CATEGORIZE_BIG_FOLDERS.py,pythons,253,1,6,SubCategorizer,Utilities,Tier_4_Utility,🗂️  SUB-CATEGORIZE BIG FOLDERS Break down folders with 500+ direct files into logical subcategories,"re, pathlib, shutil, collections",9,2025-12-04
workspace/advanced_toolkit/analyze_all_durations.py,analyze_all_durations.py,advanced_toolkit,253,0,5,,Utilities,Tier_4_Utility,Analyze ALL durations from master CSV + actual files Sort out content types by duration,"csv, subprocess, pathlib, json, collections",8,2025-11-04
workspace/advanced_toolkit/create_ultimate_master_report.py,create_ultimate_master_report.py,advanced_toolkit,252,0,3,,Utilities,Tier_4_Utility,ULTIMATE MASTER REPORT Combines all analysis into one comprehensive view,"pathlib, csv, collections",8,2025-11-04
pythons/2T-Xx-python/MEDIA_PROCESSING/image_upscaling/_archive_duplicates/auto_upscale.py,auto_upscale.py,_archive_duplicates,251,0,7,,Image_Processing,Tier_4_Utility,Automatic Image Upscaler Processes all images with multiple aspect ratios automatically,"subprocess, pathlib, shutil, os",8,2025-12-01
pythons/other-simple.py,other-simple.py,pythons,249,0,7,,Utilities,Tier_4_Utility,,"csv, os, datetime, re, logging",7,2025-11-29
workspace/advanced_toolkit/easy_organize_all.py,easy_organize_all.py,advanced_toolkit,249,0,5,,AI_Analysis,Tier_2_Medium,EASY MUSIC ORGANIZER Simple; smart organization using all gathered intelligence Understands: 322 = 3:22 duration; series patterns; etc.,"re, pathlib, csv, shutil",7,2025-11-04
pythons/AUTOMATION_BOTS/social_media_automation/social_media_part2/leonardo-convert-json-writer.py,leonardo-convert-json-writer.py,social_media_part2,248,0,8,,Utilities,Tier_4_Utility,,"time, csv, os, pathlib, datetime, PIL, logging, json, requests, dotenv",7,2025-12-01
pythons/improve_paste_export_v2.py,improve_paste_export_v2.py,pythons,246,0,3,,Utilities,Tier_4_Utility,Enhanced Paste.app export - Extract ACTUAL clipboard content from ZRAWPREVIEW,"pathlib, datetime, json, sqlite3",6,2025-12-04
pythons/audio_video_conversion/audio_editing/demo_emotional_generator.py,demo_emotional_generator.py,audio_editing,246,1,7,DemoEmotionalGenerator,Audio_Processing,Tier_3_Standard,AlchemyAPI Demo Emotional Generator Creates demo MP3 files with different emotional tones and effects,"pydub.effects, csv, os, pydub.generators, pydub, random, sys",9,2025-12-01
pythons/audio_video_conversion/youtube/clean_user_python.py,clean_user_python.py,youtube,246,0,7,,YouTube_Automation,Tier_2_Medium,Clean organization - ONLY user-created Python files; not system files,"pathlib, shutil",8,2025-12-01
workspace/advanced_toolkit/identify_files_needing_transcription.py,identify_files_needing_transcription.py,advanced_toolkit,246,0,2,,Utilities,Tier_4_Utility,Identify Files Needing Transcription for Proper Naming Many files have bad names (UUIDs; numbers; etc.) that can only be fixed  after we listen/transcribe them,"re, pathlib, csv",8,2025-11-04
pythons/2T-Xx-python/MEDIA_PROCESSING/image_upscaling/simple_upscaler.py,simple_upscaler.py,image_upscaling,245,0,7,,Image_Processing,Tier_4_Utility,Simple Interactive Image Upscaler Easy-to-use script for upscaling images with different aspect ratios,"pathlib, io, PIL, os",8,2025-12-01
pythons/CONTENT_AWARE_CATALOG/generate_optimization_suggestions.py,generate_optimization_suggestions.py,CONTENT_AWARE_CATALOG,245,0,4,,Utilities,Tier_4_Utility,Generate optimization suggestions based on all analysis,"pathlib, datetime, json",10,2025-12-04
pythons/audio.py,audio.py,pythons,244,0,9,,Audio_Processing,Tier_3_Standard,,"csv, os, mutagen.mp3, datetime, re, config, mutagen.easyid3",7,2025-05-31
pythons/FINAL_INTELLIGENT_CATEGORIZE.py,FINAL_INTELLIGENT_CATEGORIZE.py,pythons,244,1,4,FinalCategorizer,AI_Analysis,Tier_2_Medium,"🎯 FINAL INTELLIGENT CATEGORIZATION Use function names; docstrings; and file size to categorize the remaining ""general"" folders","pathlib, shutil, re, ast, collections",8,2025-12-04
pythons/CONTENT_AWARE_CATALOG/create_actionable_recommendations_report.py,create_actionable_recommendations_report.py,CONTENT_AWARE_CATALOG,244,0,3,,Utilities,Tier_4_Utility,Create a comprehensive actionable recommendations report,"pathlib, datetime, json",10,2025-12-04
pythons/STRUCTURAL_CLEANUP_MASTER.py,STRUCTURAL_CLEANUP_MASTER.py,pythons,241,1,5,StructuralCleanup,File_Organization,Tier_4_Utility,🔧 STRUCTURAL CLEANUP MASTER Fix all structural issues: nesting; empty folders; legacy; duplicates,"csv, pathlib, datetime, shutil",8,2025-12-04
pythons/AUTOMATION_BOTS/youtube_bots/youtube_part1/youtube-get-creation.py,youtube-get-creation.py,youtube_part1,240,0,9,,YouTube_Automation,Tier_2_Medium,,"csv, os, datetime, re, mutagen.mp4, logging",7,2025-12-04
pythons/AUTOMATION_BOTS/social_media_automation/social_media_part1/ident.py,ident.py,social_media_part1,240,0,4,,AI_Integration,Tier_4_Utility,,"csv, os, openai, pathlib, logging, dotenv",7,2025-12-01
pythons/home_cleanup.py,home_cleanup.py,pythons,239,1,9,HomeCleanup,File_Organization,Tier_3_Standard,Home Directory Cleanup Utility Automatically organizes files in the home directory,"os, pathlib, datetime, shutil, json, hashlib",8,2025-12-01
pythons/AUTOMATION_BOTS/social_media_automation/Instagram-Bot/TikTok-Compilation-Video-Generator/TikTok Video Generator/vidGen.py,vidGen.py,TikTok Video Generator,239,0,5,,Instagram_Automation,Tier_4_Utility,,"time, settings, os, distutils.dir_util, subprocess, datetime, shutil, random, re, cv2",7,2025-12-01
pythons/file_organization/CLEANUP_LOVE_IN_IMPERFECTION_v2.py,CLEANUP_LOVE_IN_IMPERFECTION_v2.py,file_organization,237,0,1,,File_Organization,Tier_4_Utility,from datetime import datetime from pathlib import Path import json import shutil Clean up Love_In_Imperfection folder - consolidate and organize by duration NAMING CONVENTION: file313 = 3:13 duration;,,8,2025-12-01
pythons/AUTOMATION_BOTS/youtube_bots/youtube_part2/youtube-upload.py,youtube-upload.py,youtube_part2,237,0,7,,YouTube_Automation,Tier_2_Medium,,"time, datetime, selenium.webdriver.support.ui, selenium.webdriver.common.by, selenium.webdriver.remote.webelement, re, selenium.webdriver.remote.webdriver, selenium.webdriver.common.keys, selenium.com",7,2025-12-04
pythons/complete_final_cleanup.py,complete_final_cleanup.py,pythons,236,1,4,CompleteFinalCleanup,File_Organization,Tier_4_Utility,Complete Final Cleanup - Handle ALL remaining root items,"pathlib, datetime, shutil, sys, collections",9,2025-12-01
pythons/audio_video_conversion/api_clients/emotional_quiz_generator.py,emotional_quiz_generator.py,api_clients,236,1,4,EmotionalQuizGenerator,Audio_Processing,Tier_4_Utility,AlchemyAPI Emotional Quiz Generator Creates emotionally engaging quiz MP3s using OpenAI TTS with SSML,"csv, os, random, json, requests, dotenv, sys",8,2025-12-01
pythons/AUTOMATION_BOTS/social_media_automation/social_media_part1/instagram-bot-comment.py,instagram-bot-comment.py,social_media_part1,235,0,5,,Instagram_Automation,Tier_4_Utility,,"time, os, pathlib, selenium, random, logging, selenium.webdriver.common.keys, art",7,2025-12-01
workspace/advanced_toolkit/create_master_csv_all_fields.py,create_master_csv_all_fields.py,advanced_toolkit,235,0,3,,Data_Processing,Tier_4_Utility,Create MASTER CSV with ALL fields from all sources Every single piece of data in one place,"pathlib, csv, collections",8,2025-11-04
pythons/implement_organization.py,implement_organization.py,pythons,233,0,4,,Utilities,Tier_4_Utility,IMPLEMENTATION SCRIPT FOR PYTHON SCRIPTS ORGANIZATION  This script implements the organization; sorting; and deduplication plan for /Users/steven/pythons directory.  IMPORTANT: This script will make a,"hashlib, pathlib, shutil, os",9,2025-12-04
pythons/audio_video_conversion/web_automation/twitchClips.py,twitchClips.py,web_automation,232,1,9,Clip,Twitch_Automation,Tier_3_Standard,,"time, bs4, os, moviepy.editor, selenium.webdriver.support.ui, selenium, logging, requests, urllib.request",7,2025-12-01
workspace/advanced_toolkit/batch_add_metadata.py,batch_add_metadata.py,advanced_toolkit,232,0,2,,Utilities,Tier_4_Utility,Batch add metadata to audio files Uses data from master CSV to populate missing tags,"subprocess, pathlib, csv, shutil",7,2025-11-04
pythons/audio_video_conversion/analyzers/fix_file_analysis.py,fix_file_analysis.py,analyzers,231,0,4,,Audio_Processing,Tier_4_Utility,Fix file type analysis - properly categorize by actual file type; not content,"pathlib, shutil",7,2025-12-01
pythons/Complete_Cleanup_Orchestrator.py,Complete_Cleanup_Orchestrator.py,pythons,230,1,7,CleanupOrchestrator,Orchestration,Tier_2_Medium,Complete Cleanup Orchestrator Coordinates all cleanup operations for the specified folder,"argparse, subprocess, pathlib, datetime, sys",8,2025-12-01
workspace/advanced_toolkit/create_unified_master_catalog.py,create_unified_master_catalog.py,advanced_toolkit,228,0,2,,Utilities,Tier_4_Utility,Create Unified Master Catalog Merge existing COMPLETE_METADATA_CATALOG with comprehensive reanalysis,"pathlib, csv, collections",8,2025-11-04
pythons/audio_video_conversion/downloaders/content_aware_flatten.py,content_aware_flatten.py,downloaders,226,0,5,,Audio_Processing,Tier_4_Utility,Content-aware folder flattening script Analyzes file content to determine proper categorization,"pathlib, shutil, os",8,2025-12-01
pythons/documentation/quick_catalog_volumes.py,quick_catalog_volumes.py,documentation,226,0,1,,Utilities,Tier_4_Utility,from datetime import datetime from pathlib import Path import csv import os import subprocess Quick Catalog of /Volumes Images Fast listing without heavy metadata extraction,,6,2025-12-01
pythons/documentation/LLM_Course_Engineers_Handbook_Cover/Fine_tune_a_Mistral_7b_model_with_DPO.py,Fine_tune_a_Mistral_7b_model_with_DPO.py,LLM_Course_Engineers_Handbook_Cover,226,0,1,,Utilities,Tier_4_Utility,,"gc, google.colab, wandb, transformers, datasets, peft, trl, torch",4,2025-12-01
pythons/AUTOMATION_BOTS/web_scrapers/scrapers/upwork_multi_feed_scraper.py,upwork_multi_feed_scraper.py,scrapers,226,0,1,,Web_Scraping,Tier_2_Medium,,"asyncio, argparse, os, playwright.async_api, pathlib, datetime, re, pandas, json",8,2025-12-01
pythons/SMART_SUB_CATEGORIZE.py,SMART_SUB_CATEGORIZE.py,pythons,225,1,4,SmartSubCategorizer,AI_Analysis,Tier_2_Medium,"🧠 SMART SUB-CATEGORIZER Use AST analysis and content intelligence to properly categorize the ""misc"" folders","pathlib, shutil, re, ast, collections",9,2025-12-04
pythons/audio_video_conversion/tiktok/tiktok.py,tiktok.py,tiktok,224,0,3,,Audio_Processing,Tier_4_Utility,,"time, settings, pymediainfo, scriptwrapper, database, traceback, sys, TikTokAPI",7,2025-12-01
workspace/advanced_toolkit/integrate_google_sheet.py,integrate_google_sheet.py,advanced_toolkit,221,0,6,,Utilities,Tier_4_Utility,Integrate Google Sheet Data Compare Google Sheet with local files and all CSVs,"pathlib, difflib, csv, collections",6,2025-11-04
pythons/organize_html_files.py,organize_html_files.py,pythons,219,1,9,HTMLOrganizer,File_Organization,Tier_3_Standard,Organize HTML Files Back to Site Folders Moves HTML files from scattered locations back to their appropriate site directories,"pathlib, logging, shutil",8,2025-12-01
pythons/file_organization/analyze-file-migration.py,analyze-file-migration.py,file_organization,219,0,5,,Utilities,Tier_4_Utility,from pathlib import Path Analyze current structure and show what will be migrated where,,7,2025-12-01
pythons/AUTOMATION_BOTS/youtube_bots/youtube_part2/youtube-web-scraping-download-main.py,youtube-web-scraping-download-main.py,youtube_part2,219,0,3,,YouTube_Automation,Tier_2_Medium,,"time, mpv, pathlib, selenium, speech_recognition, re, pyttsx3, logging, requests, selenium.webdriver.firefox.options",6,2025-12-04
pythons/AUTOMATION_BOTS/social_media_automation/social_media_part1/classify.py,classify.py,social_media_part1,219,0,5,,AI_Analysis,Tier_2_Medium,,"csv, os, openai, pathlib, datetime, logging, ast, dotenv",7,2025-12-01
pythons/REMOVE_CONTENT_DUPLICATES.py,REMOVE_CONTENT_DUPLICATES.py,pythons,216,1,6,ContentDuplicateRemover,AI_Analysis,Tier_2_Medium,🗑️ REMOVE CONTENT DUPLICATES Remove files with identical/similar CODE (regardless of name),"csv, pathlib, datetime, shutil, ast",7,2025-12-04
pythons/printify-organize.py,printify-organize.py,pythons,216,0,7,,File_Organization,Tier_4_Utility,,"time, pytesseract, tqdm, csv, os, datetime, PIL, numpy, cv2",6,2025-10-26
workspace/advanced_toolkit/analyze_both_music_folders.py,analyze_both_music_folders.py,advanced_toolkit,215,0,2,,Audio_Processing,Tier_4_Utility,Analyze Both Music Folders Compare ~/Music vs ~/music and suggest unified structure,"pathlib, csv, collections",7,2025-11-04
pythons/audio_video_conversion/generators/simple_backup_1.py,simple_backup_1.py,generators,214,0,1,,Audio_Processing,Tier_4_Utility,Simple Backup System for AvaTarArTs Projects Creates focused backup of our actual work,"pathlib, datetime, shutil, os",6,2025-12-01
pythons/code_analysis/analyze_home_fast.py,analyze_home_fast.py,code_analysis,214,0,4,,Utilities,Tier_4_Utility,from collections import defaultdict from datetime import datetime from pathlib import Path import json import os import re Fast Deep Content-Aware Analysis - Optimized Version Scans key directories fi,,5,2025-12-01
pythons/audio_video_conversion/generators/simple_demo.py,simple_demo.py,generators,212,0,8,,Audio_Processing,Tier_4_Utility,Simple Demo: Enhanced Content Analysis Improvements  This script demonstrates the improvements made to the content analysis system without requiring external dependencies.,"pathlib, csv, collections",9,2025-12-01
pythons/audio_video_conversion/video_editing/MetadataHandler.py,MetadataHandler.py,video_editing,212,1,14,MetadataHandler,Audio_Processing,Tier_2_Medium,,"os, src, moviepy.editor, datetime, moviepy.video.fx.rotate, random, config, jinja2, logging, src.APIHandler",8,2025-12-01
pythons/audio_video_conversion/scraping/ultra_specific_categorizer.py,ultra_specific_categorizer.py,scraping,210,1,6,UltraSpecificCategorizer,Audio_Processing,Tier_4_Utility,"Ultra-Specific Functional Categorizer Creates action-based categories like ""transcribe-analysis""; ""upscaler""; ""gallery-generator"" NOT broad categories like ""image-processing"" or ""video-processing""","pathlib, datetime, json",9,2025-12-01
pythons/AUTOMATION_BOTS/social_media_automation/social_media_part1/instagram-root-scripts.py,instagram-root-scripts.py,social_media_part1,210,1,4,RootScriptOrganizer,Instagram_Automation,Tier_4_Utility,from datetime import datetime from pathlib import Path import shutil Organize Root Python Scripts by Content  Moves all remaining .py files from root into appropriate category folders.,argparse,6,2025-12-01
pythons/FAST_SIMILARITY_SCANNER.py,FAST_SIMILARITY_SCANNER.py,pythons,209,1,6,FastSimilarityScanner,AI_Analysis,Tier_2_Medium,⚡ FAST SIMILARITY SCANNER Quick detection of similar files using function/class signatures,"pathlib, datetime, shutil, ast, collections",6,2025-12-04
pythons/file_organization/PROCESS_BATCH_RENAMES.py,PROCESS_BATCH_RENAMES.py,file_organization,208,0,2,,Utilities,Tier_4_Utility,from datetime import datetime from pathlib import Path import csv import shutil import sys Batch Rename Processor Reads batch analysis CSVs and executes approved renames  Usage:     python PROCESS_BAT,,6,2025-12-01
pythons/AUTOMATION_BOTS/social_media_automation/Instagram-Bot/Automated Reddit to Youtube Bot/thumbnail.py,thumbnail.py,Automated Reddit to Youtube Bot,208,2,4,"meta, Video",YouTube_Automation,Tier_2_Medium,,"settings, nltk.corpus, moviepy.editor, textwrap, pathlib, nltk, random, logging, lexica",4,2025-12-01
pythons/audio_video_conversion/tts/emotional_tts_generator.py,emotional_tts_generator.py,tts,207,1,4,EmotionalTTSGenerator,Audio_Processing,Tier_4_Utility,AlchemyAPI Emotional TTS Generator Creates emotionally rich MP3 files using OpenAI TTS with SSML emotions,"os, re, json, requests, dotenv, sys",7,2025-12-01
pythons/printify-organize_1.py,printify-organize_1.py,pythons,204,0,7,,File_Organization,Tier_4_Utility,,"time, pytesseract, tqdm, csv, os, datetime, PIL, numpy, cv2",6,2025-10-19
pythons/AUTOMATION_BOTS/bot_tools/promote_archived_projects.py,promote_archived_projects.py,bot_tools,203,1,4,ArchivedProjectPromoter,Utilities,Tier_4_Utility,Promote Archived Projects to Main Categories Analyze directory-based projects in archived_items and move to proper categories,"pathlib, datetime, shutil, sys, collections",7,2025-12-01
workspace/advanced_toolkit/analyze_current_structure.py,analyze_current_structure.py,advanced_toolkit,203,0,3,,Utilities,Tier_4_Utility,Analyze Current Music Structure Understand existing organization and suggest improvements,"pathlib, csv, collections",6,2025-11-04
pythons/file_organization/standardize_folders_and_cleanup.py,standardize_folders_and_cleanup.py,file_organization,201,0,4,,File_Organization,Tier_4_Utility,from datetime import datetime from pathlib import Path import csv import os import shutil Standardize folder names and clean up loose files in root directory.,,6,2025-12-01
pythons/multi_depth_scan_downloads.py,multi_depth_scan_downloads.py,pythons,200,0,2,,Utilities,Tier_4_Utility,Multi-depth folder scan of Downloads directory. Analyzes structure; sizes; file types; and organization at multiple depth levels.,"csv, os, pathlib, datetime, collections",7,2025-12-25
pythons/migrate_old_dirs.py,migrate_old_dirs.py,pythons,199,1,3,OldDirectoryMigrator,Utilities,Tier_4_Utility,Migrate Old Directories to Context-Fluid Structure Move remaining old category directories into new adaptive structure,"pathlib, shutil, sys",9,2025-12-01
pythons/AGGRESSIVE_DEDUPE.py,AGGRESSIVE_DEDUPE.py,pythons,199,1,5,AggressiveDedupe,AI_Analysis,Tier_2_Medium,🔥 AGGRESSIVE DEDUPLICATION Remove ALL versioned files (file_1.py; file (1).py; file copy.py; etc.) Keep only the best version of each base filename,"pathlib, datetime, shutil, re, ast, collections",6,2025-12-04
pythons/2T-Xx-python/MEDIA_PROCESSING/image_upscaling/_archive_duplicates/batch_upscale.py,batch_upscale.py,_archive_duplicates,199,0,5,,Image_Processing,Tier_4_Utility,Batch Image Upscaler Processes all images in the current directory with different aspect ratios,"pathlib, io, PIL, os",6,2025-12-01
pythons/AUTOMATION_BOTS/social_media_automation/Instagram-Bot/PrNdOwN/setup.py,setup.py,PrNdOwN,198,2,9,"BuildBin, Build",Instagram_Automation,Tier_3_Standard,PrNdOwN setup file.  Examples:     Windows::          python setup.py py2exe      Linux::          python setup.py install      Build source distribution::          python setup.py sdist      Build pl,"distutils.command.build, os, py2exe, subprocess, shutil, distutils.core, glob, PrNdOwN, sys, distutils",4,2025-12-01
pythons/file_organization/ORGANIZE_BY_ALBUM_STRUCTURE.py,ORGANIZE_BY_ALBUM_STRUCTURE.py,file_organization,196,0,1,,File_Organization,Tier_4_Utility,from pathlib import Path import re import shutil  from mutagen import File as MutagenFile from mutagen.easyid3 import EasyID3 from mutagen.mp3 import MP3 Organize nocTurneMeLoDieS by album with subdir,,5,2025-12-01
pythons/AUTOMATION_BOTS/web_scrapers/web_scraping/crawl.py,crawl.py,web_scraping,195,0,6,,Web_Scraping,Tier_2_Medium,,"pathlib, re, utils.console, rich.console, logging, toml",5,2025-12-01
pythons/organize_experiments.py,organize_experiments.py,pythons,194,1,3,ExperimentsOrganizer,File_Organization,Tier_4_Utility,Organize Experiments Directory Apply intelligent categorization to experiments/ contents,"pathlib, datetime, shutil, sys",7,2025-12-01
pythons/audio_video_conversion/downloaders/processor_generator.py,processor_generator.py,downloaders,194,3,23,"TikTokVideo, ClipWrapper, ScriptWrapper",Audio_Processing,Tier_2_Medium,,"math, datetime, os, pickle",5,2025-12-01
pythons/audio_video_conversion/video_editing/ClipHandler.py,ClipHandler.py,video_editing,193,1,8,ClipHandler,Audio_Processing,Tier_3_Standard,,"os, src, tensorflow, pathlib, moviepy.editor, src.Clip, numpy, src.MetadataHandler, config, src.APIHandler",7,2025-12-01
pythons/2T-Xx-python/MEDIA_PROCESSING/image_upscaling/core/cache.py,cache.py,core,193,1,9,ImageCache,Image_Processing,Tier_3_Standard,Caching layer for image processing results.  This module provides caching functionality to avoid reprocessing images that have already been processed with the same parameters.,"hashlib, os, pathlib, json, typing",4,2025-12-01
pythons/AUTOMATION_BOTS/social_media_automation/social_media_part2/leonardo-api.py,leonardo-api.py,social_media_part2,193,0,8,,Utilities,Tier_4_Utility,,"time, os, pathlib, PIL, logging, json, requests, dotenv, sys",6,2025-12-01
pythons/function_scanner.py,function_scanner.py,pythons,192,1,8,FunctionScanner,AI_Analysis,Tier_2_Medium,Deep Content Function Scanner Analyzes all Python files to extract function definitions and signatures,"os, pathlib, datetime, json, ast, collections",7,2025-12-04
pythons/undo-collection-and-merge.py,undo-collection-and-merge.py,pythons,192,2,7,"Colors, UndoAndMergeCollection",Utilities,Tier_3_Standard,🔄 UNDO COLLECTION FIX & MERGE INTO NOCTURNE ============================================= 1. Move all songs back from albums to Steven_Chaplinski_Collection 2. Distribute ALL songs from collection int,"argparse, pathlib, datetime, shutil",7,2025-11-29
workspace/advanced_toolkit/fix_bundle_names.py,fix_bundle_names.py,advanced_toolkit,192,0,5,,Utilities,Tier_4_Utility,Fix Bundle Folder Names Clean up inconsistent naming in song bundles,"re, pathlib",5,2025-11-04
pythons/storykeytrans.py,storykeytrans.py,pythons,191,0,5,,AI_Integration,Tier_4_Utility,,"os, openai, pathlib, logging, dotenv",8,2025-12-04
pythons/final_root_cleanup.py,final_root_cleanup.py,pythons,190,1,3,FinalRootCleanup,File_Organization,Tier_4_Utility,Final Root Directory Cleanup Organize remaining loose items into context-fluid structure,"pathlib, datetime, shutil, sys, collections",8,2025-12-01
pythons/audio_video_conversion/uncategorized/cli.py,cli.py,uncategorized,190,0,1,,YouTube_Automation,Tier_2_Medium,,"argparse, os, logging, pkg_resources, youtube_bulk_upload",7,2025-12-01
pythons/AUTOMATION_BOTS/social_media_automation/social_media_part2/upload-api.py,upload-api.py,social_media_part2,190,0,6,,AI_Integration,Tier_4_Utility,,"time, tqdm, csv, os, openai, pathlib, dotenv",6,2025-12-01
pythons/CLEANUP_ROOT_DUPLICATES.py,CLEANUP_ROOT_DUPLICATES.py,pythons,189,1,8,DuplicateRemover,File_Organization,Tier_3_Standard,🗑️ CLEANUP ROOT DUPLICATES Remove duplicate files from root that already exist in organized folders,"pathlib, datetime, shutil, sys, hashlib",6,2025-12-04
pythons/audio_video_conversion/generators/index_repo.py,index_repo.py,generators,189,1,8,FileEntry,Audio_Processing,Tier_3_Standard,,"dataclasses, csv, os, __future__, pathlib, json, typing",5,2025-12-01
pythons/file_organization/universal_rename.py,universal_rename.py,file_organization,189,0,5,,Utilities,Tier_4_Utility,,"csv, os, subprocess, pathlib, shutil, re",5,2025-12-01
pythons/code_analysis/automated-fixer.py,automated-fixer.py,code_analysis,189,1,6,AutomatedFixer,Utilities,Tier_4_Utility,,argparse,6,2025-12-01
pythons/AUTOMATION_BOTS/youtube_bots/youtube_part1/youtube-bot-1.py,youtube-bot-1.py,youtube_part1,189,0,4,,YouTube_Automation,Tier_2_Medium,,"time, pyautogui, PIL, tkinter.ttk, selenium, logging, requests, tkinter",5,2025-12-04
pythons/upwork_multi_feed_scraper.py,upwork_multi_feed_scraper.py,pythons,188,0,1,,Web_Scraping,Tier_2_Medium,,"asyncio, argparse, playwright.async_api, pathlib, datetime, re, pandas, json",7,2025-12-04
pythons/audio_video_conversion/transcription/pipeline.py,pipeline.py,transcription,188,2,7,"ClipCandidate, OpusClonePipeline",Audio_Processing,Tier_3_Standard,,"dataclasses, os, captions, subprocess, __future__, brand, re, whisper, json, typing",6,2025-12-01
