filepath,filename,parent_folder,lines,num_classes,num_functions,class_names,category,revenue_tier,docstring,key_imports,file_size_kb,last_modified
pythons/AUTOMATION_BOTS/bot_tools/intelligent_medium_automation.py,intelligent_medium_automation.py,bot_tools,2063,1,55,IntelligentMediumAutomation,Content_Generation,Tier_1_High,Intelligent Medium Article Automation System =========================================== Enhanced with Content-Aware Analysis for Superior Code Understanding,"math, hashlib, csv, os, pathlib, datetime, random, re, webbrowser, json",78,2025-12-01
pythons/convert_vid_from_file-organizer.py,convert_vid_from_file-organizer.py,pythons,2031,1,35,Chebyshev,File_Organization,Tier_3_Standard,==================================================== Chebyshev Series (:mod:`numpy.polynomial.chebyshev`) ====================================================  This module provides a number of objects,"polynomial, numpy.linalg, numpy, numpy.lib.array_utils, _polybase",60,2025-12-01
pythons/audio_video_conversion/complex_tools/github_repo_manager.py,github_repo_manager.py,complex_tools,1677,1,17,GitHubRepoManager,Audio_Processing,Tier_2_Medium,Enhanced GitHub Repository Manager Comprehensive tool for managing and improving GitHub repositories,"github_repo_analyzer, pathlib, datetime, shutil, logging, sys, typing",47,2025-12-01
pythons/audio_video_conversion/api_clients/downloader.py,downloader.py,api_clients,1547,3,38,"config_reader, parser_args, download",Audio_Processing,Tier_2_Medium,Important Notes: External Downloader And its args do only work in specific video formats In platforms like (youtube) Unfortunately It doesn't work on PH And Other Sites. Edit: It Works Now :),"time, yt_dlp, os, configparser, __future__, shutil, colors, random, banner, validators",50,2025-12-01
pythons/parse_vid_from_file-organizer.py,parse_vid_from_file-organizer.py,pythons,1498,0,13,,File_Organization,Tier_3_Standard,Implementation of optimized einsum.,"numpy._core.numeric, itertools, operator, numpy._core.multiarray, numpy._core.overrides",51,2025-12-01
pythons/utilities/complex_tools/seo_domination_engine_v2.py,seo_domination_engine_v2.py,complex_tools,1449,7,54,"ContentSemanticAnalysis, KeywordIntelligence, SEOArchitecturalPattern, ContentAwareSemanticAnalyzer, KeywordIntelligenceEngine",SEO_Optimization,Tier_1_High,🚀 Advanced SEO Domination Engine v2.0 =======================================  Enhanced with Deep Content-Aware Intelligence: - AST-based semantic content analysis - ML-powered keyword clustering & in,"argparse, dataclasses, hashlib, os, openai, pathlib, datetime, numpy, re, sklearn.metrics.pairwise",54,2025-12-27
pythons/audio_video_conversion/scraping/create_code_browser.py,create_code_browser.py,scraping,1310,1,21,CodeBrowserGenerator,Audio_Processing,Tier_2_Medium,Code Browser Generator Creates a visual code browser similar to avatararts.org/dalle.html Displays Python scripts as interactive cards with code previews,"re, pathlib, datetime, json",38,2025-12-01
pythons/file_organization/intelligent-renamer-1.py,intelligent-renamer-1.py,file_organization,1245,3,19,"Colors, Emojis, IntelligentRenamer",AI_Integration,Tier_2_Medium,,"google.generativeai, argparse, os, openai, pathlib, datetime, re, logging, json, dotenv",44,2025-12-01
pythons/audio_video_conversion/functional_category_analyzer.py,functional_category_analyzer.py,audio_video_conversion,1222,1,12,FunctionalCategoryAnalyzer,AI_Analysis,Tier_2_Medium,Functional Category Analyzer =========================== Analyze Python scripts and categorize them by specific functional actions rather than broad generic categories.,"csv, os, pathlib, datetime, random, re, logging, json, ast, collections",44,2025-12-01
pythons/code_analysis/ai-stability-code.py,ai-stability-code.py,code_analysis,1171,7,22,"Insight, FileContext, AnalysisResult, ContextAnalyzer, InsightGenerator",Utilities,Tier_3_Standard,,"argparse, dataclasses, pathlib, datetime, re, logging, json, typing, collections",40,2025-12-01
pythons/documentation/html-docs-generator.py,html-docs-generator.py,documentation,1136,1,11,SimpleDocsGenerator,Utilities,Tier_3_Standard,from pathlib import Path import json Simple HTML Documentation Generator Creates a comprehensive HTML documentation website without Sphinx dependencies,,33,2025-12-01
pythons/audio_video_conversion/consolidate_scripts_1.py,consolidate_scripts_1.py,audio_video_conversion,1050,1,11,ScriptConsolidator,Audio_Processing,Tier_2_Medium,Script Consolidation and Duplicate Removal Tool  This script consolidates; merges; and removes duplicates from the Python music processing scripts. It creates optimized; consolidated versions with the,"hashlib, os, pathlib, shutil, logging, typing",39,2025-12-01
pythons/audio_video_conversion/ULTIMATE_FILE_MANAGER.py,ULTIMATE_FILE_MANAGER.py,audio_video_conversion,1039,1,25,UltimateFileManager,Audio_Processing,Tier_2_Medium,Ultimate File Manager - Comprehensive File Processing; Organization; and Deduplication Tool  This script combines the best features from: - Advanced File Processor (file conversion; processing; metada,"time, concurrent.futures, argparse, hashlib, os, subprocess, openai, pathlib, datetime, shutil",37,2025-12-01
pythons/AUTOMATION_BOTS/social_media_automation/Instagram-Bot/bot.py,bot.py,Instagram-Bot,1024,1,153,Bot,Instagram_Automation,Tier_2_Medium,,"bot_archive, api, bot_photo, bot_like, bot_delete, logging, pkg_resources, atexit, bot_filter, bot_get",31,2025-12-01
pythons/audio_video_conversion/video_editing/update_github_repo.py,update_github_repo.py,video_editing,1007,1,13,GitHubRepoUpdater,Audio_Processing,Tier_2_Medium,GitHub Repository Update Script Updates your GitHub Python repository with all the new tools and documentation,"pathlib, datetime, shutil, os",31,2025-12-01
pythons/convert_text_from_file-organizer.py,convert_text_from_file-organizer.py,pythons,979,2,47,"MyTextFileReader, MyCParserWrapper",File_Organization,Tier_3_Standard,Tests that work on both the Python and C engines but do not have a specific classification into the other test modules.,"pytest, pandas._config, pandas._testing, pandas.io.parsers.c_parser_wrapper, os, pandas.io.parsers, pandas.compat, pathlib, datetime, numpy",30,2025-12-01
pythons/audio_video_conversion/complex_tools/comprehensive_doc_generator_1.py,comprehensive_doc_generator_1.py,complex_tools,959,1,18,ComprehensiveDocGenerator,Audio_Processing,Tier_2_Medium,Comprehensive Documentation Generator Creates professional documentation including Sphinx; PyDoc; and more,"os, subprocess, pathlib, datetime, shutil, logging",25,2025-12-01
pythons/code_analysis/deep-code.py,deep-code.py,code_analysis,909,6,24,"Colors, Emojis, AICodeAnalyzer, VectorEmbeddingAnalyzer, ArchitecturalPatternDetector",AI_Integration,Tier_2_Medium,,"google.generativeai, anthropic, os, openai, pathlib, datetime, numpy, re, logging, json",32,2025-12-01
pythons/audio_video_conversion/comprehensive_deep_analyzer.py,comprehensive_deep_analyzer.py,audio_video_conversion,885,1,13,ComprehensiveDeepAnalyzer,Audio_Processing,Tier_2_Medium,Comprehensive Deep Analyzer for Steven Chaplinski's Complete Portfolio Content-aware analysis of all directories with detailed HTML generation,"mimetypes, os, pathlib, datetime, shutil, re, json, hashlib, collections",28,2025-12-01
pythons/AUTOMATION_BOTS/social_media_automation/social_media_part2/validate-json-reader.py,validate-json-reader.py,social_media_part2,850,2,17,"Colors, APIKeyManager",Utilities,Tier_3_Standard,,"argparse, os, subprocess, pathlib, re, webbrowser, logging, dotenv",29,2025-12-01
pythons/AUTOMATION_BOTS/bot_tools/setup_sphinx_docs_uv.py,setup_sphinx_docs_uv.py,bot_tools,846,1,16,SphinxDocSetup,Utilities,Tier_3_Standard,Sphinx Documentation Setup Script (UV Compatible) Creates comprehensive documentation for all Python projects,"os, subprocess, pathlib, json, sys",25,2025-12-01
pythons/documentation/generate-rich-docs.py,generate-rich-docs.py,documentation,839,1,7,RichDocGenerator,Utilities,Tier_3_Standard,from collections import Counter from datetime import datetime from pathlib import Path from pathlib import Path as PathLib import os  from dotenv import load_dotenv Rich Documentation Generator for Sc,,31,2025-12-01
pythons/analyzerr.py,analyzerr.py,pythons,836,3,30,"Target, Config, TargetCalculator",Utilities,Tier_3_Standard,This script is intended for use as a GYP_GENERATOR. It takes as input (by way of the generator flag config_path) the path of a json file that dictates the files and targets to search for. The followin,"gyp.common, posixpath, json, os",31,2025-12-04
pythons/code_analysis/instagram-ecosystem-master.py,instagram-ecosystem-master.py,code_analysis,792,1,12,EcosystemMasterMapper,Instagram_Automation,Tier_2_Medium,from collections import defaultdict; Counter from datetime import datetime from pathlib import Path import ast import csv import hashlib import json import os import re  import difflib Python Ecosyste,,27,2025-12-01
pythons/DEEP ENV & VOLUMES CONTENT-AWARE ANALYZER.py,DEEP ENV & VOLUMES CONTENT-AWARE ANALYZER.py,pythons,791,4,13,"EnvFileAnalysis, VolumeAnalysis, ComprehensiveAnalysis, DeepEnvVolumesAnalyzer",Utilities,Tier_3_Standard,🔍 DEEP ENV & VOLUMES CONTENT-AWARE ANALYZER Comprehensive intelligent analysis of .env.d and /Volumes directories  Features: - Environment variable and API key analysis (secure; no exposure) - Multi-v,"mimetypes, argparse, dataclasses, hashlib, os, subprocess, advanced_toolkit.config_manager, pathlib, datetime, advanced_toolkit.file_intelligence",28,2025-12-04
pythons/audio_video_conversion/automation/setup_social_media_automation_1.py,setup_social_media_automation_1.py,automation,757,1,12,SocialMediaAutomationSetup,Audio_Processing,Tier_2_Medium,Social Media Automation Setup Script Sets up n8n workflows; backend services; and database for social media automation,"os, pathlib, logging, json, sys",21,2025-12-01
pythons/get_instagram_from_file-organizer.py,get_instagram_from_file-organizer.py,pythons,744,0,19,,Instagram_Automation,Tier_2_Medium,miscellaneous sorting / groupby utilities ,"collections.abc, pandas._typing, pandas.core.dtypes.common, __future__, pandas.core.indexes.api, numpy, pandas.core.construction, pandas.core.indexes.base, pandas.core.dtypes.missing, pandas._libs.has",22,2025-12-01
pythons/documentation/create-sphinx-docs.py,create-sphinx-docs.py,documentation,723,1,11,SphinxDocsGenerator,Utilities,Tier_3_Standard,from pathlib import Path from pathlib import Path as PathLib import subprocess  from dotenv import load_dotenv 📚 SPHINX DOCUMENTATION GENERATOR ==================================  Creates professional,,19,2025-12-01
pythons/send_text_from_file-organizer.py,send_text_from_file-organizer.py,pythons,721,2,20,"BaseAdapter, HTTPAdapter",File_Organization,Tier_3_Standard,requests.adapters ~~~~~~~~~~~~~~~~~  This module contains the transport adapters that Requests uses to define and maintain connections.,"pip._vendor.urllib3.util.ssl_, pip._vendor.urllib3.contrib.socks, cookies, compat, socket, structures, pip._vendor.urllib3.util, ssl, pip._vendor.urllib3.poolmanager, auth",26,2025-12-01
pythons/audio_video_conversion/python_repo_analyzer.py,python_repo_analyzer.py,audio_video_conversion,716,1,11,PythonRepoAnalyzer,Audio_Processing,Tier_2_Medium,Python Repository Analyzer & Portfolio Generator Analyzes Python scripts; categorizes them with GPT-4; and generates portfolio-ready outputs,"csv, os, subprocess, openai, pathlib, datetime, re, pandas, json, dotenv",25,2025-12-01
pythons/AUTOMATION_BOTS/social_media_automation/social_media_part2/social-platforms-instagram-bot-error.py,social-platforms-instagram-bot-error.py,social_media_part2,702,0,18,,Instagram_Automation,Tier_2_Medium,,"time, os, pathlib, selenium, platform, pyfiglet, logging, selenium.webdriver.common.keys",21,2025-12-01
pythons/audio_video_conversion/intelligent_analyzer_merger.py,intelligent_analyzer_merger.py,audio_video_conversion,687,1,22,IntelligentAnalyzerMerger,Audio_Processing,Tier_2_Medium,Intelligent File Analyzer and Merger  This script analyzes all files in the directory; compares their functionality; and creates one comprehensive solution that combines all the best elements.,"time, os, pathlib, datetime, shutil, re, logging, json, sys, difflib",24,2025-12-01
pythons/audio_video_conversion/deep_analysis_merge.py,deep_analysis_merge.py,audio_video_conversion,675,1,14,DeepAnalysisMerger,Audio_Processing,Tier_2_Medium,Deep Analysis and Intelligent Merge Tool  This script performs deep content analysis of Python files to identify: 1. Exact duplicates (same content) 2. Similar files (similar functionality with variat,"os, pathlib, datetime, shutil, re, logging, json, sys, difflib, typing",24,2025-12-01
pythons/organize_and_optimize.py,organize_and_optimize.py,pythons,645,1,12,FileOrganizer,File_Organization,Tier_3_Standard,Comprehensive File Organization and Optimization Script Migrates files to new structure and optimizes content,"re, PIL, pathlib, shutil",20,2025-12-01
pythons/audio_video_conversion/deep_zip_analyzer.py,deep_zip_analyzer.py,audio_video_conversion,639,1,12,DeepZipAnalyzer,Audio_Processing,Tier_2_Medium,Deep ZIP Directory Content Awareness Analyzer Comprehensive analysis of large ZIP collections with deep folder scanning,"mimetypes, os, zipfile, pathlib, datetime, shutil, re, json, hashlib, collections",23,2025-12-01
pythons/2T-Xx-python/MEDIA_PROCESSING/image_upscaling/improved_batch_upscaler_2_1.py,improved_batch_upscaler_2_1.py,image_upscaling,638,0,0,,Image_Processing,Tier_4_Utility,,,23,2025-10-14
pythons/directory_merger_organizer.py,directory_merger_organizer.py,pythons,637,1,11,DirectoryMergerOrganizer,SEO_Optimization,Tier_2_Medium,Directory Merger & Organizer for Steven Chaplinski's Portfolio Merges content from seo-win; MySiTes; python-docs; and blog-versions Creates comprehensive HTML-based organization system,"os, datetime, shutil, re, json",20,2025-12-01
pythons/AUTOMATION_BOTS/bot_tools/song_analysis_generator.py,song_analysis_generator.py,bot_tools,635,2,15,"SongAnalysis, SongAnalysisGenerator",Utilities,Tier_3_Standard,Comprehensive Song Analysis Generator Applies detailed narrative logic for visual storytelling and image generation,"dataclasses, csv, pathlib, re, json, typing",29,2025-12-01
pythons/simple_organize.py,simple_organize.py,pythons,622,1,11,SimpleFileOrganizer,File_Organization,Tier_3_Standard,Simple File Organization Script Migrates files to new structure without external dependencies,"re, pathlib, shutil",19,2025-12-01
pythons/AUTOMATION_BOTS/social_media_automation/social_media_part1/ai-deep-analyzer.py,ai-deep-analyzer.py,social_media_part1,616,7,19,"Colors, Emojis, AICodeAnalyzer, VectorEmbeddingAnalyzer, ArchitecturalPatternDetector",AI_Integration,Tier_2_Medium,,"google.generativeai, os, openai, pathlib, datetime, numpy, re, logging, json, dotenv",20,2025-12-01
pythons/audio_video_conversion/audio_converters/audio_video_editors_twitch.py,audio_video_editors_twitch.py,audio_converters,615,2,17,"AudioVideoProcessor, TwitchAPIHandler",Twitch_Automation,Tier_3_Standard,AI-Powered Automated Video Clip Generator & Stream Highlight Extractor ====================================================================== Create viral short-form content from long-form videos usin,"time, ffmpeg, subprocess, moviepy.editor, new_token, numpy, pandas, moviepy.video.io.ffmpeg_tools, json, requests",23,2025-12-04
pythons/documentation/project-catalog-generator.py,project-catalog-generator.py,documentation,610,2,16,"AdvancedSystem, AdvancedSystemsCatalog",Utilities,Tier_3_Standard,from collections import defaultdict from dataclasses import dataclass; field from pathlib import Path from typing import Dict; List; Any import json 🏗️ ADVANCED SYSTEMS CATALOG =======================,csv,18,2025-12-01
pythons/code_analysis/intelligent-code-orchestrator.py,intelligent-code-orchestrator.py,code_analysis,604,1,10,IntelligentCodeOrchestrator,Orchestration,Tier_2_Medium,from datetime import datetime from pathlib import Path from pathlib import Path as PathLib from typing import Dict; List; Any import ast import asyncio import json import logging import os  from anthr,,21,2025-12-01
pythons/audio_video_conversion/web_apps/auto_update_github_1.py,auto_update_github_1.py,web_apps,587,1,13,GitHubAutoUpdater,Audio_Processing,Tier_2_Medium,Auto Update GitHub Repository Automatically uploads all Python projects to GitHub with proper structure and documentation,"subprocess, pathlib, datetime, shutil, logging",15,2025-12-01
pythons/audio_video_conversion/complex_tools/bulk_upload.py,bulk_upload.py,complex_tools,568,1,15,YouTubeBulkUpload,Audio_Processing,Tier_2_Medium,,"os, tempfile, google_auth_oauthlib.flow, google.auth.transport.requests, re, logging, json, googleapiclient.http, googleapiclient.discovery, thefuzz",23,2025-12-01
workspace/advanced_toolkit/customer_retention_engine.py,customer_retention_engine.py,advanced_toolkit,561,3,12,"Customer, RetentionAction, CustomerRetentionEngine",Utilities,Tier_3_Standard,💰 CUSTOMER RETENTION ENGINE Advanced content-aware customer retention and revenue optimization system  Features: - Tracks customer interactions across all revenue streams - AI-powered personalization ,"dataclasses, sqlite3, pathlib, datetime, file_intelligence, json, sys, config_manager, typing, collections",19,2025-11-25
workspace/advanced_toolkit/suno_organizer.py,suno_organizer.py,advanced_toolkit,560,1,14,SunoOrganizer,File_Organization,Tier_3_Standard,Suno Music Organizer (avatararts = Suno artist) Comprehensive organizer for YOUR_SUNO_SONGS with intelligent categorization,"argparse, pathlib, datetime, shutil, re, file_intelligence, json, config_manager, typing, collections",21,2025-11-04
pythons/tehSiTes_ultimate_cleanup.py,tehSiTes_ultimate_cleanup.py,pythons,558,1,14,UltimateTehSiTesCleanup,AI_Analysis,Tier_2_Medium,TehSiTes Ultimate Deep Research & Content-Aware Cleanup Combines all analysis techniques: merge; diff; remove; organize with deep intelligence,"time, os, pathlib, datetime, shutil, re, logging, difflib, hashlib, collections",23,2025-12-01
pythons/robust_sort_and_dedupe_merged.py,robust_sort_and_dedupe_merged.py,pythons,550,0,0,,Utilities,Tier_4_Utility,,,22,2025-10-15
pythons/AUTOMATION_BOTS/youtube_bots/youtube_seo_optimizer.py,youtube_seo_optimizer.py,youtube_bots,550,3,14,"YouTubeVideo, SEOAnalysis, YouTubeSEOOptimizer",SEO_Optimization,Tier_2_Medium,🎬 YOUTUBE SEO OPTIMIZER Content-aware SEO optimization for YouTube videos  Integrates with: - content-orchestrator.py (YouTube content generation) - multi-llm-orchestrator.py (AI routing) - content_cl,"argparse, dataclasses, pathlib, multi_llm_orchestrator, json, sys, content_orchestrator, typing",20,2025-11-29
pythons/audio_video_conversion/complex_tools/backup_system_1.py,backup_system_1.py,complex_tools,545,1,7,AvaTarArTsBackupSystem,Audio_Processing,Tier_3_Standard,Comprehensive Backup System for AvaTarArTs Projects Creates organized backups and manages ongoing updates,"os, pathlib, datetime, shutil, json",17,2025-12-01
pythons/audio_video_conversion/complex_tools/unified_generation.py,unified_generation.py,complex_tools,543,1,15,AdvancedOrganizer,Audio_Processing,Tier_2_Medium,UNIFIED SOLUTION - Comprehensive File Manager  This file combines the best functionality from 130 files: - setup.sh - start_analytics.sh - advanced_content_generator.py - image-gpt.py - split-2.py - y,"time, argparse, pathlib, shutil, re, logging, typing, hashlib, collections",19,2025-12-01
pythons/streamlit_apps/cloud-services-aws-streamlit.py,cloud-services-aws-streamlit.py,streamlit_apps,540,2,14,"ModelConfig, Sender",Web_App,Tier_3_Standard,Entrypoint for streamlit; see https://docs.streamlit.io/,"base64, pathlib, streamlit.delta_generator, contextlib, httpx, traceback, google.auth.exceptions, google.auth, boto3, dataclasses",19,2025-11-29
pythons/AUTOMATION_BOTS/bot_tools/intelligent_file_analysis.py,intelligent_file_analysis.py,bot_tools,536,1,13,IntelligentFileAnalyzer,Utilities,Tier_3_Standard,Intelligent File Analysis with Content Awareness ============================================== Analyzes out-of-place files using content awareness to provide intelligent descriptions and organization,"csv, os, pathlib, datetime, re, json, collections",20,2025-12-01
pythons/AUTOMATION_BOTS/social_media_automation/social_media_part1/identify-leonardo-user-scripts.py,identify-leonardo-user-scripts.py,social_media_part1,536,2,9,"Colors, UserScriptIdentifier",AI_Analysis,Tier_2_Medium,,"argparse, csv, os, pathlib, datetime, logging, ast, dotenv",17,2025-12-01
workspace/advanced_toolkit/comprehensive_mp3_reanalysis.py,comprehensive_mp3_reanalysis.py,advanced_toolkit,536,0,10,,AI_Analysis,Tier_2_Medium,Comprehensive MP3 Reanalysis Using ALL gathered intelligence to deeply analyze every MP3,"csv, subprocess, pathlib, re, difflib, json, hashlib, collections",18,2025-11-04
pythons/AUTOMATION_BOTS/bot_tools/integrate_business_ecosystems_1.py,integrate_business_ecosystems_1.py,bot_tools,533,1,9,BusinessEcosystemIntegrator,Utilities,Tier_3_Standard,Business Ecosystem Integration Script Integrates QuantumForge Labs with existing AI Alchemy business setup,"os, pathlib, shutil, logging, typing",16,2025-12-01
pythons/2T-Xx-python/MEDIA_PROCESSING/image_upscaling/core/image_utils.py,image_utils.py,core,529,0,11,,Image_Processing,Tier_3_Standard,Core image processing utilities shared across all upscaling scripts.  This module provides platform-agnostic utilities for image processing; automatically detecting and using the best available image ,"subprocess, pathlib, shutil, PIL, platform, exceptions, contextlib, functools, typing",15,2025-12-04
pythons/code_analysis/python-complexity-analyzer.py,python-complexity-analyzer.py,code_analysis,526,1,13,AdvancedPythonAnalyzer,Utilities,Tier_3_Standard,,"matplotlib.pyplot, radon.complexity, radon.metrics, networkx, os, radon, subprocess, datetime, platform, pylint",18,2025-12-01
pythons/AUTOMATION_BOTS/bot_tools/poolmanager_1.py,poolmanager_1.py,bot_tools,524,2,19,"PoolManager, ProxyManager",Utilities,Tier_3_Standard,,"packages.six.moves.urllib.parse, request, util.url, _collections, util.proxy, exceptions, connectionpool, logging, packages, functools",19,2025-12-01
pythons/AUTOMATION_BOTS/social_media_automation/social_media_part1/instagram-dom-tree.py,instagram-dom-tree.py,social_media_part1,518,0,40,,Instagram_Automation,Tier_2_Medium,from tqdm import tqdm All methods must return media_ids that can be passed into e.g. like() or comment() functions.,,14,2025-12-01
pythons/scripty.py,scripty.py,pythons,515,0,23,,AI_Integration,Tier_2_Medium,scripty_tts_unified_v2.py All-in-one audiobook TTS engine with: - Model auto-selection (prefers OpenAI gpt-4o-tts; falls back to other tts/audio; then HF Bark) - Cheerful Guide persona with micro-paus,"time, math, argparse, os, openai, pathlib, pydub, random, re, requests",16,2025-11-29
workspace/advanced_toolkit/file_intelligence.py,file_intelligence.py,advanced_toolkit,505,3,23,"FileFingerprint, FileIntelligenceDB, FileAnalyzer",AI_Analysis,Tier_1_High,Advanced File Intelligence System Combines AST analysis; content fingerprinting; and ML-based classification,"mimetypes, PyPDF2, hashlib, dataclasses, sqlite3, subprocess, pathlib, PIL, re, json",16,2025-11-04
pythons/AUTOMATION_BOTS/social_media_automation/social_media_part1/instagram-download.py,instagram-download.py,social_media_part1,503,1,10,ContentAwareOrganizer,Instagram_Automation,Tier_2_Medium,from datetime import datetime from pathlib import Path import json Content-Aware Etsy Collection Organizer Uses deep analysis to create intelligent organization without breaking existing projects.,,17,2025-12-01
pythons/audio_video_conversion/zip_archive_analyzer.py,zip_archive_analyzer.py,audio_video_conversion,498,1,10,ZipArchiveAnalyzer,Audio_Processing,Tier_3_Standard,ZIP Archive Analyzer and Cleanup Tool Analyzes ZIP files in the Etsy collection for optimization opportunities,"os, zipfile, pathlib, datetime, shutil, re, json, hashlib",18,2025-12-01
pythons/migrate_projects.py,migrate_projects.py,pythons,497,1,16,ProjectMigrator,Utilities,Tier_3_Standard,Automated Python Projects Reorganization Script Safely migrates your projects to the new organized structure,"pathlib, datetime, json, shutil",18,2025-12-01
pythons/audio_video_conversion/complex_tools/project_manager_1.py,project_manager_1.py,complex_tools,496,1,9,AvaTarArTsProjectManager,Audio_Processing,Tier_3_Standard,AvaTarArTs Project Manager Manages ongoing updates and project organization,"os, pathlib, datetime, shutil, json",15,2025-12-01
pythons/audio_video_conversion/audio_editing/advanced_demo_generator.py,advanced_demo_generator.py,audio_editing,495,1,20,AdvancedDemoGenerator,Audio_Processing,Tier_2_Medium,AlchemyAPI Advanced Demo Generator Creates sophisticated demo MP3s with complex audio patterns and emotional characteristics,"pydub.effects, os, pydub.generators, datetime, random, json, sys",20,2025-12-01
pythons/proc_vid_from_file-organizer.py,proc_vid_from_file-organizer.py,pythons,489,0,0,,File_Organization,Tier_4_Utility,,,17,2025-10-14
pythons/file_organization/python-script-renamer.py,python-script-renamer.py,file_organization,483,1,14,SimplePythonRenamer,Utilities,Tier_3_Standard,from collections import Counter from pathlib import Path from typing import Dict; List; Optional import ast import logging import re import subprocess Simple Python Renamer for ~/Documents/python Foll,"argparse, json",16,2025-12-01
