filepath,filename,parent_folder,lines,num_classes,num_functions,class_names,category,revenue_tier,docstring,key_imports,file_size_kb,last_modified
pythons/COMPREHENSIVE_DIRECTORY_CLEANUP.py,COMPREHENSIVE_DIRECTORY_CLEANUP.py,pythons,329,1,6,DirectoryOrganizer,File_Organization,Tier_3_Standard,🧹 COMPREHENSIVE DIRECTORY CLEANUP Fix ~/pythons/ at the DIRECTORY level - consolidate; organize; clean,"os, pathlib, datetime, shutil, sys, collections",11,2025-12-04
pythons/AUTOMATION_BOTS/social_media_automation/social_media_part1/instagram-requirements.py,instagram-requirements.py,social_media_part1,325,0,6,,Instagram_Automation,Tier_4_Utility,from collections import defaultdict from pathlib import Path from typing import Set; Dict; List import ast import json Intelligent Requirements Generator Analyzes Python files to extract and generate ,argparse,8,2025-12-01
pythons/file_organization/REORGANIZE_SINGLES_FINAL.py,REORGANIZE_SINGLES_FINAL.py,file_organization,324,0,1,,File_Organization,Tier_4_Utility,from datetime import datetime from pathlib import Path import json import shutil Reorganize Singles folder - FINAL VERSION - Move 44 files to album folders - Move 14 files to root nocTurneMeLoDieS fol,,10,2025-12-01
pythons/2T-Xx-python/MEDIA_PROCESSING/image_upscaling/_archive_duplicates/batch_upscaler.py,batch_upscaler.py,_archive_duplicates,323,0,10,,Image_Processing,Tier_3_Standard,Batch Image Upscaler Processes images in small batches to avoid system overload Based on the proven 9mbs.py approach using macOS sips,"time, os, subprocess, pathlib, shutil",10,2025-12-01
workspace/advanced_toolkit/reanalyze_music_metadata.py,reanalyze_music_metadata.py,advanced_toolkit,323,0,6,,Audio_Processing,Tier_4_Utility,Reanalyze ALL Metadata in ~/music Deep scan of lowercase music folder for complete understanding,"csv, subprocess, pathlib, json, hashlib, collections",10,2025-11-04
workspace/advanced_toolkit/find_all_related_content.py,find_all_related_content.py,advanced_toolkit,322,0,5,,Utilities,Tier_4_Utility,Find ALL related content for songs in master CSV Searches entire ~/ for prompts; lyrics; images; videos; etc.,"csv, pathlib, re, difflib, collections",11,2025-11-04
pythons/etsy_focused_cleanup.py,etsy_focused_cleanup.py,pythons,320,1,6,FocusedEtsyCleanup,File_Organization,Tier_3_Standard,Focused Etsy Cleanup Tool Efficient cleanup for large-scale duplicate and archive management,"os, pathlib, datetime, shutil, re, json, collections",12,2025-12-01
pythons/AUTOMATION_BOTS/bot_tools/intelligent_file_renamer.py,intelligent_file_renamer.py,bot_tools,320,1,7,IntelligentFileRenamer,AI_Analysis,Tier_2_Medium,Intelligent Content-Aware File Renamer Analyzes file content to suggest better; more descriptive names,"argparse, os, subprocess, pathlib, re, logging, json, ast, typing, collections",11,2025-12-01
pythons/AUTOMATION_BOTS/social_media_automation/Instagram-Bot/ReportBot.py,ReportBot.py,Instagram-Bot,319,0,9,,Instagram_Automation,Tier_3_Standard,,"time, libs.utils, help, libs.proxy_harvester, libs.animation, os, firebase_admin, libs.check_modules, colorama, libs.logo",14,2025-12-01
pythons/file_organization/batch-cleanup-analyzer.py,batch-cleanup-analyzer.py,file_organization,318,1,8,BatchCleanupAnalyzer,File_Organization,Tier_3_Standard,from pathlib import Path import csv import hashlib import json Batch-Based External Volume Cleanup Analyzer Process volumes incrementally to avoid timeouts,sys,10,2025-12-01
pythons/organizer_2.py,organizer_2.py,pythons,317,3,14,"FileProcessor, MediaProcessor, ScriptAnalyzer",File_Organization,Tier_3_Standard,,"csv, os, mutagen.mp3, openai, pathlib, datetime, PIL, mutagen, re, mutagen.mp4",10,2025-12-01
workspace/advanced_toolkit/comprehensive_cross_reference.py,comprehensive_cross_reference.py,advanced_toolkit,316,0,6,,Utilities,Tier_4_Utility,Comprehensive Cross-Reference Find ALL related content for each audio file: - Lyrics; transcripts - DALL-E prompts; Sora prompts; all prompts - Videos (mp4; mov) - PDFs - HTMLs - Markdown files - Imag,"re, pathlib, difflib, csv",11,2025-11-04
pythons/file_organization/organize_into_albums.py,organize_into_albums.py,file_organization,315,0,3,,File_Organization,Tier_4_Utility,from collections import defaultdict from pathlib import Path import csv import re import shutil ?? ORGANIZE SUNO COLLECTION INTO ALBUMS Analyze content; rename; and sort 349 MP3s into proper album fol,,8,2025-12-01
pythons/2T-Xx-python/MEDIA_PROCESSING/image_upscaling/web_upscaler_v2.py,web_upscaler_v2.py,image_upscaling,315,0,4,,Image_Processing,Tier_4_Utility,Web Image Upscaler (v2) Converts and upscales web images (WEBP; TIFF) to PNG/JPEG. Uses core utilities for consistent processing.,"os, pathlib, PIL, core, typing",9,2025-12-01
pythons/test_sort_values_2_1.py,test_sort_values_2_1.py,pythons,314,1,16,TestSortValues,Data_Processing,Tier_3_Standard,,"pytest, pandas, pandas._testing, numpy",11,2025-12-01
pythons/aggressive-python-cleanup.py,aggressive-python-cleanup.py,pythons,312,0,0,,File_Organization,Tier_4_Utility,,,11,2025-12-04
pythons/file_organization/smart_organize_with_metadata.py,smart_organize_with_metadata.py,file_organization,311,0,3,,File_Organization,Tier_4_Utility,from collections import defaultdict from pathlib import Path import csv import re import shutil ?? SMART ORGANIZER WITH METADATA Use CSV metadata (lyrics; tags; style) to intelligently organize 349 MP,,9,2025-12-01
pythons/AUTOMATION_BOTS/social_media_automation/social_media_part2/parse-api.py,parse-api.py,social_media_part2,311,0,8,,AI_Integration,Tier_4_Utility,,"time, concurrent.futures, tqdm, os, openai, pathlib, termcolor, logging, dotenv, sys",11,2025-12-01
pythons/AGGRESSIVE_CLEANUP_EXECUTE.py,AGGRESSIVE_CLEANUP_EXECUTE.py,pythons,309,1,3,AggressiveCleanup,File_Organization,Tier_4_Utility,🧹 AGGRESSIVE CLEANUP - FIX EVERYTHING Consolidate 131 directories → ~25 clean directories,"pathlib, datetime, shutil, os",10,2025-12-04
pythons/AUTOMATION_BOTS/youtube_bots/youtube_part2/youtube-title-case.py,youtube-title-case.py,youtube_part2,308,0,3,,YouTube_Automation,Tier_2_Medium,Skill Initializer - Creates a new skill from template  Usage:     init_skill.py <skill-name> --path <path>  Examples:     init_skill.py my-new-skill --path skills/public     init_skill.py my-api-helpe,"pathlib, sys",10,2025-12-04
pythons/CONTENT_SIMILARITY_SCANNER.py,CONTENT_SIMILARITY_SCANNER.py,pythons,306,1,8,ContentSimilarityScanner,AI_Analysis,Tier_2_Medium,🔍 CONTENT SIMILARITY SCANNER Find files with similar CODE/FUNCTIONALITY (not just names),"csv, pathlib, datetime, difflib, ast, hashlib, collections",11,2025-12-04
pythons/deep-home-scan.py,deep-home-scan.py,pythons,306,0,6,,Utilities,Tier_4_Utility,Deep Multi-Depth Home Directory Scanner Comprehensive analysis of ~/ directory structure and sizes,"os, subprocess, pathlib, datetime, json, sys, collections",11,2025-12-04
pythons/audio_video_conversion/pandocfilters.py,pandocfilters.py,audio_video_conversion,306,0,13,,Audio_Processing,Tier_3_Standard,Functions to aid writing python scripts that process the pandoc AST serialized as JSON.,"os, codecs, tempfile, shutil, json, sys, io, hashlib, atexit",8,2025-12-01
pythons/2T-Xx-python/MEDIA_PROCESSING/image_upscaling/_archive_duplicates/upscale_system.py,upscale_system.py,_archive_duplicates,306,0,9,,Image_Processing,Tier_3_Standard,System-based Image Upscaler Uses macOS built-in tools (sips) to process images with aspect ratios Based on the proven 9mbs.py approach,"subprocess, pathlib, shutil, os",10,2025-12-01
pythons/AUTOMATION_BOTS/social_media_automation/social_media_part2/verify.py,verify.py,social_media_part2,306,1,9,Colors,Utilities,Tier_3_Standard,,"os, pathlib, ollama, importlib, logging, dotenv, sys",9,2025-12-01
pythons/file_organization/SMART_CLEANUP.py,SMART_CLEANUP.py,file_organization,304,0,1,,File_Organization,Tier_4_Utility,from datetime import datetime from pathlib import Path import shutil Smart Cleanup - Move empire stuff to ~/workspace; keep only music in nocTurneMeLoDieS,,7,2025-12-01
pythons/code_analysis/master_metadata_applier.py,master_metadata_applier.py,code_analysis,304,2,8,"Colors, MasterMetadataApplier",Utilities,Tier_3_Standard,from pathlib import Path import csv import os import re import sys  from difflib import SequenceMatcher from mutagen.easyid3 import EasyID3 from mutagen.id3 import ID3NoHeaderError MASTER METADATA APP,argparse,10,2025-12-01
pythons/AUTOMATION_BOTS/social_media_automation/social_media_part2/resize.py,resize.py,social_media_part2,304,0,7,,AI_Integration,Tier_4_Utility,,"time, csv, os, openai, pathlib, datetime, PIL, logging, dotenv",9,2025-12-01
pythons/organize_plan_proposal.py,organize_plan_proposal.py,pythons,303,1,6,PythonScriptsOrganizer,File_Organization,Tier_3_Standard,Organization Plan Implementation Script  This script outlines the proposed changes for organizing;  sorting; and deduplicating the Python scripts in /Users/steven/pythons. It does NOT make actual chan,"os, pathlib, shutil, json, hashlib",13,2025-12-04
pythons/migrate_remaining_fixed.py,migrate_remaining_fixed.py,pythons,301,0,5,,Utilities,Tier_4_Utility,Second Migration Pass - Organize Remaining Python Files (Fixed Version),"pathlib, shutil",14,2025-12-01
pythons/multi_folder_content_search.py,multi_folder_content_search.py,pythons,299,1,8,MultiFolderContentSearch,Utilities,Tier_3_Standard,Deep Multi-Folder Content Search Tool Searches across multiple directories for common content patterns; functions; and functionality,"os, pathlib, datetime, re, json, collections",13,2025-12-04
pythons/code_analysis/consolidate-python-ecosystem.py,consolidate-python-ecosystem.py,code_analysis,299,2,8,"Colors, FinalConsolidator",Utilities,Tier_3_Standard,,"argparse, subprocess, pathlib, datetime, shutil, logging, hashlib",10,2025-12-01
pythons/SMART_VERSION_CONSOLIDATION.py,SMART_VERSION_CONSOLIDATION.py,pythons,297,1,6,SmartConsolidator,Utilities,Tier_4_Utility,🎯 SMART VERSION CONSOLIDATION Automatically handle version differences based on intelligent analysis  ACTIONS: 1. Root Expanded (8 files) → Replace organized version with root 2. Organized Expanded (4,"csv, pathlib, datetime, shutil, sys",11,2025-12-04
pythons/documentation/analyze_catalog_for_albums.py,analyze_catalog_for_albums.py,documentation,295,0,4,,Utilities,Tier_4_Utility,from collections import Counter import re  import pandas as pd Analyze Full Catalog and Suggest Album Compilations Creates a strategic release plan for all 590 songs,,8,2025-12-01
pythons/deep_structure_cleanup.py,deep_structure_cleanup.py,pythons,294,1,12,DeepStructureCleanup,File_Organization,Tier_3_Standard,Deep Structure Cleanup Script Cleans up Python virtual environments; package management; and development tools that create excessive directory depth,"time, os, subprocess, pathlib, datetime, shutil, logging",11,2025-12-01
pythons/AUTOMATION_BOTS/social_media_automation/Instagram-Bot/bot_filter.py,bot_filter.py,Instagram-Bot,293,0,10,,Instagram_Automation,Tier_3_Standard,Filter functions for media and user lists.,,9,2025-12-01
pythons/AUTOMATION_BOTS/social_media_automation/social_media_part2/process-remix.py,process-remix.py,social_media_part2,293,0,10,,Utilities,Tier_3_Standard,,"csv, os, pathlib, logging, dotenv, sys",10,2025-12-01
pythons/AUTOMATION_BOTS/social_media_automation/social_media_part1/instagram-ecosystem-insights.py,instagram-ecosystem-insights.py,social_media_part1,291,0,1,,Instagram_Automation,Tier_4_Utility,from collections import defaultdict; Counter from datetime import datetime from pathlib import Path import json Python Ecosystem Insights Deep analysis of your massive 6-level Python directory structu,,9,2025-12-01
workspace/advanced_toolkit/merge_all_google_sheets.py,merge_all_google_sheets.py,advanced_toolkit,291,0,6,,Utilities,Tier_4_Utility,Merge ALL Google Sheets + Local Data Comprehensive integration of all data sources,"pathlib, difflib, csv, collections",10,2025-11-04
pythons/ULTRA_AGGRESSIVE_SIMILARITY.py,ULTRA_AGGRESSIVE_SIMILARITY.py,pythons,290,1,9,UltraAggressiveScanner,AI_Analysis,Tier_2_Medium,🔥 ULTRA AGGRESSIVE SIMILARITY SCANNER Find files that are 80%+ similar in content/structure Lower threshold to catch more duplicates,"pathlib, datetime, shutil, difflib, ast, collections",10,2025-12-04
pythons/create_search_interface.py,create_search_interface.py,pythons,289,0,1,,Utilities,Tier_4_Utility,Create searchable HTML interface for all exports,"datetime, pathlib, html",8,2025-12-04
pythons/album-sorting.py,album-sorting.py,pythons,287,2,9,"Colors, AlbumSorter",Utilities,Tier_3_Standard,🎵 ADVANCED ALBUM SORTING & RENAMING TOOL (Unified Version) ========================================================= Automates the organization of your music library by: 1. Recursively scanning for MP,"argparse, mutagen.easyid3, csv, os, mutagen.mp3, pathlib, shutil, re, logging, sys",11,2025-12-04
pythons/FIND_DUPLICATE_CONTENT.py,FIND_DUPLICATE_CONTENT.py,pythons,285,1,9,DuplicateFinder,Utilities,Tier_3_Standard,🔍 FIND DUPLICATE CONTENT & SIMILAR FILENAMES Find files that are duplicates or near-duplicates (renamed versions),"csv, pathlib, datetime, re, difflib, hashlib, collections",10,2025-12-04
pythons/code_analysis/create_master_catalog.py,create_master_catalog.py,code_analysis,285,0,8,,Utilities,Tier_4_Utility,from datetime import datetime from pathlib import Path import csv import os  from mutagen.easyid3 import EasyID3 from mutagen.id3 import ID3NoHeaderError from mutagen.mp3 import MP3 Create a comprehen,,8,2025-12-01
pythons/audio_video_conversion/analyzers/synthesize_text.py,synthesize_text.py,analyzers,284,2,14,"LocalTTSProvider, AsAManThinkethLocalTTS",Audio_Processing,Tier_2_Medium,Local TTS System for As a Man Thinketh Uses system TTS capabilities to create audio files,"os, subprocess, pathlib, sys, typing",9,2025-12-01
pythons/AUTOMATION_BOTS/youtube_bots/youtube_part1/youtube-VIEWBOT.py,youtube-VIEWBOT.py,youtube_part1,284,1,1,Color,YouTube_Automation,Tier_2_Medium,,"time, random, webbrowser, logging, threading",15,2025-12-04
pythons/AUTOMATION_BOTS/social_media_automation/social_media_part2/instagram-scan-leonardo-comprehensive.py,instagram-scan-leonardo-comprehensive.py,social_media_part2,284,1,7,FinalComprehensiveScan,Instagram_Automation,Tier_3_Standard,from collections import defaultdict from pathlib import Path import ast import hashlib import re Final Comprehensive Scan - Uses ALL tools available  Analyzes your entire Python ecosystem with: - File,,9,2025-12-01
pythons/execute_ultimate_reorganization.py,execute_ultimate_reorganization.py,pythons,282,1,8,UltimateReorganizer,Utilities,Tier_3_Standard,Execute Ultimate Reorganization Uses the ultimate analysis to reorganize files intelligently,"argparse, pathlib, datetime, shutil, json, typing, sys",8,2025-12-01
pythons/audio_video_conversion/find_script.py,find_script.py,audio_video_conversion,281,1,10,ScriptFinder,Audio_Processing,Tier_3_Standard,Python Script Finder and Navigator Helps you locate any Python script in your organized structure,"re, pathlib, os, collections",10,2025-12-01
pythons/AUTOMATION_BOTS/youtube_bots/organize-youtube-root.py,organize-youtube-root.py,youtube_bots,280,1,9,FinalRootOrganizer,YouTube_Automation,Tier_2_Medium,Final Root Directory Organizer  Organizes all remaining loose files in root directory into proper structure.,"argparse, pathlib, datetime, shutil",9,2025-11-29
pythons/create_mamba_environments.py,create_mamba_environments.py,pythons,277,0,4,,Utilities,Tier_4_Utility,Create Miniforge/Mamba environment files from requirements.txt files and analyze ~/pythons; ~/pythons-sort directories.,"re, pathlib",10,2025-12-25
pythons/file_organization/rename_and_standardize.py,rename_and_standardize.py,file_organization,277,0,3,,Utilities,Tier_4_Utility,from pathlib import Path import csv import re import shutil ?? COMPREHENSIVE RENAMER Standardize both MP3 and transcript filenames for clean matching,,8,2025-12-01
pythons/audio_video_conversion/test_pylabtools.py,test_pylabtools.py,audio_video_conversion,276,2,20,"TestPylabSwitch, Shell",Audio_Processing,Tier_2_Medium,Tests for pylab tools module.,"pytest, IPython.core.interactiveshell, IPython.core.getipython, IPython.testing, numpy, binascii, PIL, IPython.core.display, matplotlib.figure, matplotlib_inline",7,2025-12-01
pythons/AUTOMATION_BOTS/social_media_automation/social_media_part1/instagram-eliminate.py,instagram-eliminate.py,social_media_part1,276,1,5,ArchiveEliminator,Instagram_Automation,Tier_4_Utility,from collections import defaultdict from pathlib import Path import shutil Eliminate Archive Directories Move all items from _archived_cleanup and _organized_root_files into proper context-fluid categ,"datetime, sys",8,2025-12-01
pythons/AUTOMATION_BOTS/social_media_automation/social_media_part2/uploader.py,uploader.py,social_media_part2,275,3,14,"SimplePhotoGalleryHTTPServer, SimplePhotoGalleryHTTPRequestHandler, NetlifyUploader",Utilities,Tier_3_Standard,,"urllib, os, zipfile, tempfile, pathlib, simplegallery.common, http.server, webbrowser, jinja2, simplegallery.upload.base_uploader",9,2025-12-01
workspace/advanced_toolkit/download_missing_songs.py,download_missing_songs.py,advanced_toolkit,275,0,4,,Utilities,Tier_4_Utility,Download missing songs from Suno Uses Song URLs from the master CSV,"time, csv, subprocess, pathlib, urllib.parse, json",8,2025-11-04
pythons/audio_video_conversion/macos_tts_generator.py,macos_tts_generator.py,audio_video_conversion,274,0,3,,Audio_Processing,Tier_4_Utility,"macOS TTS Generator for ""As a Man Thinketh"" Uses macOS built-in 'say' command to generate audiobook","subprocess, pathlib, datetime, os",15,2025-12-01
pythons/CONTENT_AWARE_CATALOG/analyze_csv_patterns.py,analyze_csv_patterns.py,CONTENT_AWARE_CATALOG,274,0,3,,Data_Processing,Tier_4_Utility,Analyze the Python files CSV catalog to identify patterns and insights,"csv, pathlib, datetime, re, json, collections",12,2025-12-04
pythons/CONTENT_AWARE_CATALOG/identify_consolidation_opportunities.py,identify_consolidation_opportunities.py,CONTENT_AWARE_CATALOG,274,0,8,,Utilities,Tier_4_Utility,Identify detailed consolidation opportunities in the Python codebase,"csv, pathlib, datetime, re, json, collections",11,2025-12-04
pythons/AUTOMATION_BOTS/bot_tools/eliminate_archives.py,eliminate_archives.py,bot_tools,273,1,5,ArchiveEliminator,Utilities,Tier_4_Utility,Eliminate Archive Directories Move all items from _archived_cleanup and _organized_root_files into proper context-fluid categories,"pathlib, datetime, shutil, sys, collections",8,2025-12-01
pythons/AUTOMATION_BOTS/social_media_automation/social_media_part1/all.py,all.py,social_media_part1,272,0,12,,AI_Integration,Tier_3_Standard,,"csv, os, mutagen.mp3, openai, pathlib, datetime, PIL, mutagen.mp4, logging, dotenv",8,2025-12-01
workspace/advanced_toolkit/transcribe_and_rename_workflow.py,transcribe_and_rename_workflow.py,advanced_toolkit,272,0,4,,Utilities,Tier_4_Utility,Transcribe and Rename Workflow Step 1: Transcribe files with bad names Step 2: Use transcription to generate proper names Step 3: Rename files intelligently,"csv, subprocess, pathlib, datetime, re, json",9,2025-11-04
workspace/advanced_toolkit/content_classifier.py,content_classifier.py,advanced_toolkit,272,1,6,ContentClassifier,Utilities,Tier_4_Utility,Complete Content Classifier Classifies ALL your content by type: MUSIC vs VIDEO vs PODCAST vs AUDIOBOOK All are YOUR originals; just different content types,"argparse, subprocess, pathlib, json, config_manager, typing, collections",9,2025-11-04
pythons/file_organization/flatten-all-album-structure.py,flatten-all-album-structure.py,file_organization,270,2,7,"Colors, FlattenAlbumStructure",Utilities,Tier_3_Standard,from datetime import datetime from pathlib import Path import shutil 🎵 FLATTEN ALL ALBUM STRUCTURES ================================ Remove files/; lyrics/; metadata/ subfolders Move all content direc,argparse,8,2025-12-01
workspace/advanced_toolkit/compare_findings_with_current_structure.py,compare_findings_with_current_structure.py,advanced_toolkit,269,0,3,,Utilities,Tier_4_Utility,Compare Today's Findings with Current Structure Match discovered songs against existing Vol 1-12 organization,"pathlib, difflib, csv, collections",9,2025-11-04
pythons/file_organization/ORGANIZE_DEEP_FOLDERS.py,ORGANIZE_DEEP_FOLDERS.py,file_organization,268,0,6,,File_Organization,Tier_4_Utility,from datetime import datetime from pathlib import Path import json import shutil Organize and flatten deep folder structures Identifies user-created folders (not git repos/archives) and suggests flatt,,8,2025-12-01
pythons/2T-Xx-python/MEDIA_PROCESSING/image_upscaling/_archive_duplicates/upscale_with_sips.py,upscale_with_sips.py,_archive_duplicates,268,0,7,,Image_Processing,Tier_4_Utility,Image Upscaler using macOS sips command Upscales images to 300 DPI with various aspect ratios using built-in macOS tools,"subprocess, pathlib, shutil, os",8,2025-12-01
pythons/migrate_remaining.py,migrate_remaining.py,pythons,267,0,0,,Utilities,Tier_4_Utility,,,12,2025-10-19
workspace/advanced_toolkit/cross_reference_all.py,cross_reference_all.py,advanced_toolkit,266,0,6,,Utilities,Tier_4_Utility,Cross-Reference Everything Compare 430 audio files with: - Lyrics files - Transcripts - Image prompts (album art) - DALL-E prompts Match them all together,"csv, pathlib, re, difflib, collections",8,2025-11-04
pythons/file_organization/smart_rename_with_durations.py,smart_rename_with_durations.py,file_organization,265,0,4,,Utilities,Tier_4_Utility,from collections import defaultdict from pathlib import Path import csv import re ?? SMART RENAMER WITH DURATION PRESERVATION Preserves duration codes (234 = 2:34) and version numbers,,8,2025-12-01
pythons/execute_comprehensive_cleanup.py,execute_comprehensive_cleanup.py,pythons,264,1,6,ComprehensiveCleanup,File_Organization,Tier_4_Utility,Comprehensive Cleanup and Consolidation 1. Archive terrible (meaningless) directories 2. Consolidate redundant directory groups 3. Organize loose root files,"pathlib, shutil, sys",8,2025-12-01
pythons/execute_reorganization.py,execute_reorganization.py,pythons,264,1,7,ReorganizationExecutor,Utilities,Tier_3_Standard,Execute Intelligent Reorganization Moves files into functional categories based on ML/NLP analysis,"argparse, pathlib, datetime, shutil, json, sys",8,2025-12-01
pythons/file_organization/CLEANUP_NOCTURNE.py,CLEANUP_NOCTURNE.py,file_organization,264,0,1,,File_Organization,Tier_4_Utility,from datetime import datetime from pathlib import Path import shutil Clean up nocTurneMeLoDieS directory - make it simple and organized,,6,2025-12-01
pythons/AUTOMATION_BOTS/social_media_automation/social_media_part1/AskReddit.py,AskReddit.py,social_media_part1,263,0,7,,Reddit_Automation,Tier_4_Utility,,"praw, yt_upload, clips, json, tinydb",8,2025-12-01
pythons/intelligent_script_reorganizer.py,intelligent_script_reorganizer.py,pythons,262,1,5,IntelligentScriptReorganizer,File_Organization,Tier_4_Utility,Intelligent Script Reorganizer Uses ML/NLP to discover natural groupings for shell scripts,"asyncio, argparse, next_gen_content_analyzer, pathlib, datetime, json, typing, sys, collections",8,2025-12-01
pythons/diagnose.py,diagnose.py,pythons,262,1,18,AnnouncingParser,Utilities,Tier_3_Standard,Diagnostic functions; mainly for use when doing tech support.,"time, bs4, html.parser, cProfile, pstats, tempfile, pathlib, random, traceback, html5lib",7,2025-11-29
workspace/advanced_toolkit/intelligent_metadata_analysis.py,intelligent_metadata_analysis.py,advanced_toolkit,262,0,3,,Utilities,Tier_4_Utility,Intelligent Metadata Analysis Uses ALL APIs from ~/.env.d/ for deep content understanding - AssemblyAI for transcription - OpenAI for content classification - Anthropic for analysis - Local Whisper as,"csv, subprocess, pathlib, json, config_manager, sys, collections",7,2025-11-04
pythons/file_organization/batch-volume-cleanup.py,batch-volume-cleanup.py,file_organization,261,1,6,BatchVolumeCleanup,File_Organization,Tier_4_Utility,from datetime import datetime from pathlib import Path import csv import hashlib import json Batch Volume Cleanup - Process Large Volumes in Chunks Smart batching to handle 65K+ files without timeouts,,8,2025-12-01
pythons/file_organization/REORGANIZE_SINGLES.py,REORGANIZE_SINGLES.py,file_organization,261,0,1,,File_Organization,Tier_4_Utility,from datetime import datetime from pathlib import Path import json import shutil Reorganize Singles folder - move files back to their proper albums Based on song titles; themes; and Suno data analysis,,8,2025-12-01
pythons/AUTOMATION_BOTS/social_media_automation/social_media_part2/named.py,named.py,social_media_part2,261,0,8,,Utilities,Tier_4_Utility,,"time, csv, os, pathlib, datetime, PIL, logging, dotenv",8,2025-12-01
pythons/file_organization/REORGANIZE_FOLDER.py,REORGANIZE_FOLDER.py,file_organization,260,0,2,,File_Organization,Tier_4_Utility,from datetime import datetime from pathlib import Path import json import shutil Reorganize Love_Is_Rubbish folder: 1. Move misplaced songs to proper folders 2. Rename remaining Love_is_Rubbish versio,,9,2025-12-01
pythons/2T-Xx-python/MEDIA_PROCESSING/image_upscaling/enhanced_9mbs.py,enhanced_9mbs.py,image_upscaling,259,0,6,,Image_Processing,Tier_4_Utility,Enhanced 9MB Image Processor Based on the proven 9mbs.py script with added aspect ratio support Processes images to 300 DPI with various aspect ratios while maintaining file size under 9MB,"pathlib, PIL, os",9,2025-12-01
pythons/improve_paste_export.py,improve_paste_export.py,pythons,258,0,3,,Utilities,Tier_4_Utility,Enhanced Paste.app export - Extract ACTUAL clipboard content,"sqlite3, pathlib, datetime, re, json, plistlib",7,2025-12-04
