Week,Task,Priority,Asset,Keyword_Target,Content_Type,Status,Expected_Time_Hours,Expected_Traffic,Expected_Revenue_Month,Notes
Week 1 Day 1-2,Content Audit and Mapping,⭐⭐⭐⭐⭐,All,All,Planning,Not Started,8,0,0,"Map all existing content to AEO keywords"
Week 1 Day 3-4,Convert AI Voice Agents README to AEO Articles,⭐⭐⭐⭐⭐,AI Voice Agents,"how to set up AI phone answering for small business",How-To,Not Started,6,1000-2000,$500-1000,"Extract README sections, convert to AEO format"
Week 1 Day 3-4,Create AI Voice Agent Comparison Article,⭐⭐⭐⭐⭐,AI Voice Agents,"what is the best AI voice agent for customer service",Comparison,Not Started,4,1500-3000,$750-1500,"Create comparison table and analysis"
Week 1 Day 5,Create AI Phone Answering Pricing Guide,⭐⭐⭐⭐⭐,AI Voice Agents,"how much does AI phone answering cost per month",Guide,Not Started,3,800-1500,$400-800,"Expand cost analysis from README"
Week 1 Day 6,Create AI Phone Answering FAQ Article,⭐⭐⭐⭐⭐,AI Voice Agents,"can AI answer phone calls for my business",FAQ,Not Started,2,1200-2000,$600-1200,"Convert to FAQ format with schema"
Week 1 Day 7,Create AI Automation Tutorial,⭐⭐⭐⭐⭐,AI Voice Agents,"how to automate customer phone calls with AI",Tutorial,Not Started,4,1000-1800,$500-900,"Include code examples from openai_voice_agent.py"
Week 2 Day 1-2,Convert Education Platform README to AEO Articles,⭐⭐⭐⭐⭐,Education Platform,"how to create AI courses automatically",How-To,Not Started,6,2000-4000,$1000-2000,"Showcase 50+ courses/day capability"
Week 2 Day 3,Create AI Course Generator Comparison,⭐⭐⭐⭐⭐,Education Platform,"what is the best AI course generator platform",Comparison,Not Started,4,1800-3500,$900-1750,"Compare platforms including yours"
Week 2 Day 4,Create AI Course Generation Case Study,⭐⭐⭐⭐⭐,Education Platform,"how many AI courses can be generated per day",Case Study,Not Started,3,1500-3000,$750-1500,"Use actual generation statistics"
Week 2 Day 5,Create AI Education Monetization Guide,⭐⭐⭐⭐,Education Platform,"how to monetize AI-generated educational content",Guide,Not Started,4,1200-2400,$600-1200,"Expand revenue model from README"
Week 2 Day 6-7,Extract Course Content for Articles,⭐⭐⭐⭐,Education Platform,Multiple,Showcase,Not Started,8,2000-5000,$1000-2500,"Extract from 3 generated courses"
Week 3 Day 1-2,Convert Retention Suite README to AEO Articles,⭐⭐⭐⭐⭐,Retention Suite,"how to reduce customer churn with retention tools",How-To,Not Started,6,3000-6000,$1500-3000,"Use suite features in guide"
Week 3 Day 3,Create Retention Platform Comparison,⭐⭐⭐⭐⭐,Retention Suite,"what is the best customer retention platform for e-commerce",Comparison,Not Started,4,2500-5000,$1250-2500,"Compare suite vs individual tools"
Week 3 Day 4,Create Gamification Implementation Guide,⭐⭐⭐⭐,Retention Suite,"how to increase customer lifetime value with gamification",Guide,Not Started,4,2000-4000,$1000-2000,"Showcase gamification features"
Week 3 Day 5-7,Create Template Showcase Articles,⭐⭐⭐⭐,Retention Suite,"customer retention templates for email marketing",Showcase,Not Started,8,1500-3000,$750-1500,"Showcase 20+ templates"
Week 4 Day 1-3,Create New Content: AI Voice Agent ROI Calculator,⭐⭐⭐⭐⭐,AI Voice Agents,"AI voice agent ROI calculator for service businesses",Calculator,Not Started,6,400-800,$200-400,"Build interactive calculator"
Week 4 Day 4-5,Create New Content: Retention Suite Comparison,⭐⭐⭐⭐,Retention Suite,"customer retention suite vs individual tools comparison",Comparison,Not Started,4,1500-3000,$750-1500,"Compare suite vs individual tools"
Week 4 Day 6-7,Expand Music FAQ with New Questions,⭐⭐⭐⭐,Creative Marketplace,Multiple,FAQ,Not Started,4,500-1000,$250-500,"Add 5-10 new questions"
Month 2 Week 1,Create 10 Developer Tools Articles,⭐⭐⭐,Python Arsenal,Multiple,Technical,Not Started,20,2000-4000,$1000-2000,"Showcase Python automation scripts"
Month 2 Week 2,Create 10 Gorilla Framework Articles,⭐⭐⭐,Gorilla Framework,Multiple,Technical,Not Started,20,1500-3000,$750-1500,"Function calling guides"
Month 2 Week 3,Create 10 Harbor LLM Articles,⭐⭐,Harbor LLM,Multiple,Setup Guides,Not Started,20,1000-2000,$500-1000,"Local LLM setup guides"
Month 2 Week 4,Create 10 OSINT/Maigret Articles,⭐⭐⭐,Maigret OSINT,Multiple,Guides,Not Started,20,1500-3000,$750-1500,"OSINT investigation guides"
Month 3 Week 1-2,Create NFT Sales Guide,⭐⭐⭐⭐,Creative Marketplace,"how to sell AI-generated art as NFTs",Guide,Not Started,8,3500-7000,$1750-3500,"Complete NFT sales guide"
Month 3 Week 3,Create AI Art Platform Comparison,⭐⭐⭐⭐,Creative Marketplace,"what is the best platform to sell AI art online",Comparison,Not Started,6,3000-6000,$1500-3000,"Compare all platforms"
Month 3 Week 4,Create Multi-Channel Monetization Guide,⭐⭐⭐,Creative Marketplace,"how to monetize AI-generated content across multiple channels",Guide,Not Started,6,2300-4600,$1150-2300,"Showcase multi-channel strategy"
