Priority,Content_Title,Keyword,Asset,Content_Type,Status,Timeline,Expected_Traffic,Expected_Revenue_Month,Research_Needed,Resources_Available
⭐⭐⭐⭐⭐,"AI Voice Agent ROI Calculator: Complete Guide 2025","AI voice agent ROI calculator for service businesses",AI Voice Agents,Calculator,New Content Needed,Week 4,400-800,$200-400,Yes,"Cost data from README, pricing models"
⭐⭐⭐⭐⭐,"AI Phone Answering vs Human Receptionist: Full Comparison","AI voice agent vs human receptionist cost comparison",AI Voice Agents,Comparison,Partial Content,Week 1,600-1200,$300-600,Partial,"Cost analysis exists, need full comparison"
⭐⭐⭐⭐⭐,"How to Set Up AI Phone Answering: Step-by-Step Tutorial","how to set up AI phone answering for small business",AI Voice Agents,How-To,Exists,Week 1,1000-2000,$500-1000,No,"README has setup info"
⭐⭐⭐⭐⭐,"How to Create 50+ AI Courses Per Day: Complete Guide","how to create AI courses automatically",Education Platform,How-To,Exists,Week 2,2000-4000,$1000-2000,No,"Platform exists, 50+ capacity documented"
⭐⭐⭐⭐⭐,"AI Course Generator Platform Comparison 2025","what is the best AI course generator platform",Education Platform,Comparison,Exists,Week 2,1800-3500,$900-1750,Yes,"Need competitor research"
⭐⭐⭐⭐⭐,"How to Reduce Customer Churn with Retention Tools","how to reduce customer churn with retention tools",Retention Suite,How-To,Exists,Week 3,3000-6000,$1500-3000,No,"Suite exists, features documented"
⭐⭐⭐⭐,"Customer Retention Suite vs Individual Tools: Comparison","customer retention suite vs individual tools comparison",Retention Suite,Comparison,New Content Needed,Week 4,1500-3000,$750-1500,Yes,"Need competitor analysis"
⭐⭐⭐⭐,"How to Sell AI-Generated Art as NFTs: Complete Guide","how to sell AI-generated art as NFTs",Creative Marketplace,Guide,New Content Needed,Month 3,3500-7000,$1750-3500,Yes,"Need NFT platform research"
⭐⭐⭐⭐,"Best Platform to Sell AI Art Online: Comparison 2025","what is the best platform to sell AI art online",Creative Marketplace,Comparison,New Content Needed,Month 3,3000-6000,$1500-3000,Yes,"Need platform comparison research"
⭐⭐⭐,"AI Course Creation vs Traditional: Time & Cost Analysis","AI course creation vs traditional course development time",Education Platform,Comparison,New Content Needed,Week 2-4,700-1400,$350-700,Yes,"Need traditional course data"
⭐⭐⭐,"How to Build an AI Education Platform: Technical Guide","how to build an AI education platform from scratch",Education Platform,Technical,Exists,Week 2,1000-2000,$500-1000,No,"Platform built, can document"
⭐⭐⭐,"What Businesses Need AI Phone Answering: Industry Analysis","what businesses need AI phone answering service",AI Voice Agents,Analysis,Exists,Week 2-3,700-1400,$350-700,Partial,"Industry list exists, need expansion"
⭐⭐⭐,"AI Voice Agent Integration Guide: Google Calendar CRM SMS","how to integrate AI phone system with Google Calendar",AI Voice Agents,Integration Guide,Exists,Week 2-3,500-1000,$250-500,No,"Integration mentioned in README"
⭐⭐⭐,"How to Reduce Missed Calls by 40% with AI Automation","how to reduce missed calls with AI automation",AI Voice Agents,ROI Guide,Exists,Week 2-3,600-1200,$300-600,Partial,"Value prop exists, need calculator"
⭐⭐⭐,"What Retention Strategies Work for SaaS Businesses","what retention strategies work for SaaS businesses",Retention Suite,Strategy Guide,New Content Needed,Month 2,1800-3500,$900-1750,Yes,"Need SaaS-specific research"
⭐⭐⭐,"How to Calculate Customer Retention Rate and Improve It","how to calculate customer retention rate and improve it",Retention Suite,Calculation Guide,New Content Needed,Month 2,1400-2800,$700-1400,Yes,"Need calculation formulas"
⭐⭐⭐,"How to Reduce 70% Visitor Bounce Rate with Retention Tools","how to reduce 70% visitor bounce rate with retention tools",Retention Suite,Case Study,New Content Needed,Month 2,800-1600,$400-800,Yes,"Need case study data"
⭐⭐⭐,"What Is the ROI of Customer Retention Software?","what is the ROI of customer retention software",Retention Suite,ROI Analysis,New Content Needed,Month 2,700-1400,$350-700,Yes,"Need ROI calculation data"
⭐⭐⭐,"How to Monetize AI Content Across Multiple Channels","how to monetize AI-generated content across multiple channels",Creative Marketplace,Guide,New Content Needed,Month 3,2300-4600,$1150-2300,Yes,"Need multi-channel strategy"
⭐⭐⭐,"AI Art Print-on-Demand vs NFT Sales: Comparison","AI art print-on-demand vs NFT sales comparison",Creative Marketplace,Comparison,New Content Needed,Month 3,1800-3500,$900-1750,Yes,"Need both platform research"
